cleaned_text,text_length
做自己就好，丁克可以找有共同理想的共度人生，想和爱的人一起有孩子就要个孩子，别你不生孩子就觉得别人生孩子就是工具就被迫就是奴隶，你生孩子就觉得不生孩子的枉了此生，这种人最恶心,87
做试管的女人都在哭，男人都在发脾气和无所谓，我在医院看到的，男人可换个老婆或者供精，女人做不成就只能离婚了，因为男女在一起就是为了繁衍，既然繁衍不了就是离婚，爱情什么的不存在的。,89
做实了女人就是生育机器,11
做人流的也不全部是那些乱来意外怀孕的，还有好多想生男孩或者女孩的，检查出来不是自己想要的性别就引产了。只能说做女人太难咯，就算结婚之前不怀孕，也免不了结婚后要去堕胎甚至引产,86
做丁克是最好选择，自己都苦，何必连累下一代。,22
坐标北美，我们学的是Mirena/Kyleena虽然是靠“激素”避孕，但是激素作用是局部的，不属于OCP那种全身吸收的。再者，mirena/kyleena没有estrogen，OCP大部分都是estrogen+progesterone。。。所以吃药的风险（比如PE）比mirena高多了。所以我这边Mirena普及率很高。反而铜环基本上没人用，因为出血量会增加，谁想要来姨妈出更多血啊。。。 社会文化不同，女性的生活质量真的太不一样了。。,219
作为一名孕妇，我只能说过于真实了，我除了没孕反和视频里几乎一样，尤其产检的部分看得又好笑又辛酸。我想说如果要生孩子一定要有家人的鼎力支持和无微不至的照顾，只靠自己撑过去几乎是不可能的。希望想生的大家顺顺利利的，不想生的一直自由潇洒吧,116
作为一个生了二胎的妈妈，我当初产检和生产的时候看到有些孕妇满肚子的红色纹路都会感到很震撼，真的太不容易了。,53
作为一个女儿，我母亲也有严重的妊娠纹，而且很多年了。最惨的是因为她生我比较早还是剖腹产是竖切，肚子上有一条黑色的蜈蚣一般的长疤痕。她总是跟我喋喋不休的抱怨，指着疤痕说这就是生我的代价。我从来不会不耐烦，因为我知道她作为一个爱美女性的痛苦。毕竟她可是曾经的中大校花，追求者众多，甚至因为长得清纯甜美成为全校合唱团里唯一的女指挥。家庭条件也好，我外公是中大教授外婆是设备处的一把手，住的是个小公馆能睡席梦思还有个舞厅。国家管制的外国电影她每周都去看，像瓦尔特保卫萨拉热窝或傲慢与偏见之类的。家里现在还留着当年的黑胶唱片，也不知道是怎么从wg时期保存下来的。她周围的朋友都叫她千金大小姐。但我妈妈继承了我外公的温柔良善，待人总是宽容又耐心。以前她每次去我的家长会都会被学校里的学生行礼叫老师，我也特别有面子特别开心，为了不给她丢脸我也总是成绩在年级前十名，这样老师宣读成绩的时候她都会笑得很开心。我爱读书的习惯也是妈妈引导的，九几年那时给我买了全套铜版纸的精装百科全书（不止一套），各种电影光碟和杂志。周末时她如果工作忙就会带我去那时刚建成不久的深圳书城，我会带着我的折叠小木凳和三明治与巧克力牛奶在里面呆一整天看书。小学时妈妈也送我去过各种兴趣班，水彩画油画电子琴围棋国际象棋书法钢琴，一开始妈妈带我去时学得很好，但后来全都半途而废了。因为我爸都是一开始不感兴趣，看我小有所成后就说要他陪我去，然后我只要稍有不妥不对就是一个耳光扇我的脸，后来我拿起笔或棋子就发抖，连下笔都不敢，因为但凡他觉得不对就会打我。连看书的习惯也差点被他毁掉。有一天我在家中房间里看书看得入神，突然他冲进房间给我一个耳光，问我为什么不回答他，他在客厅叫我。可是天地良心啊！我根本就没听到！从那以后我在家看书都不敢专心，生怕被打。幸好离婚后回了外公家，外公外婆见我看书专注从来不会打扰我，反而会很高兴，也完全不需要担心挨打。遇事外公总是会温柔耐心的对我说：“XX，我们谈谈好不好呀”，外婆更是因为我是家里的第一个孙子而宠我至极，什么都偏心我，总爱带我出门，遇到熟人就炫耀说这是我的乖孙女儿哦。外人说这是外孙女，外公外婆就会不高兴的纠正，什么外不外的，就是孙女！ 童年时所有的幸福几乎都是妈妈和外公外婆带给我的。,939
作为一个男人，我完全支持女性对于生育的完全自主。 同时我也强调：权利和义务是对等的，只想要权利不想守义务，是不可以的。,59
作为一个男谦友 我来说一下我个人想法（不喜勿喷） 我之前没看过什么客观公正的解说 我因为不碰什么饭圈微博之类的 了解的也不多 看完这个视频 我认为薛之谦几年前说把钱全给高磊鑫了 自己很穷（相对其他明星）是没问题的 婚内出轨没的讲 但如果真的是已经协议离婚那种 感觉换哪个男的来都会想着找新人 但如果不是另说 薛之谦这么看是渣了李雨桐 这我不洗 毕竟打孩子了 但是我看后面好几次都是薛之谦胜诉 说明李雨桐这人说谎什么的也不少 至于为什么还发展的这么好 我认为该法院判决的也赢了 该赔钱也赔了 对面输了说明也不是什么好东西 至于渣男嘛 毕竟和高磊鑫也又复合这么多年了还有孩子 我觉得不能彻底忘掉干的坏事 但我不会因此耿耿于怀 毕竟和什么吴亦凡李易峰华晨宇那种比起来不算太重 ，法师都能生龙活虎 薛之谦这个毕竟案子都是胜诉的 属于还可控的那种 现在薛之谦的内地各大音乐平台粉丝总数第二，仅次于周杰伦 演唱会数据更是目前的内地第一 历史前五（网上有数据） 怎么说呢 从15年左右的苦情歌极其迎合大众开始 到创作出不少有价值的歌曲 唱，编，作三样都会 尤其是作词 三样综合起来现在内娱有谁能压薛之谦？要么光会唱，要么光会作，要么数据不行 我29号在南京才看的薛之谦演唱会 怎么说呢 最为歌手是绝对过关的 都很好 搞笑加真诚 这种风格就不可能不讨喜 你要我一个男的多在乎这种娱乐圈的撕逼 我不是很关心 他渣了一回一个满嘴谎言的人 但是最后又和高磊鑫继续走下去 在我个人的接受范围内 娱乐圈他这种绝对是很频繁的 而且最关键的是谦友 最近几年 薛之谦人气一直在上升 但是没闹过什么大事 谦友也不打大仗 舆论基本上都是好风向 我们知道薛之谦单讲唱歌水平这个第二是有点德不配位 但是只要不出事就没人会吵 这种情况下天天跑巡演跑音乐节 只会进一步积攒人气,766
作为一个律师，你是专业的，你要引导正确的舆论导向，生育权你片字不提你什么意思？居心叵测不如去UC当小编 现在你编一个小故事你不给出答案，让观众发酵舆论，属实有点带节奏，搞男女对立，不如把你这身衣服脱了，你不配 罗老师是对的，有的人学法学的毫无人性！,124
作为一个不婚主义者 我有很多女基友 但我不需要女朋友（狗头保命）,32
作为一个90后并且带过避孕环的人分享一下带过之后的感觉，带了有五年多，带完这个东西就疼的在床上疼了半个多小时起不来，后面每次大姨妈以后两天腹部左边一直疼，不能受凉，下午疼疼到半夜睡着，我也是强大，疼着也能睡着，大姨妈的天数最低八天，多的十天，每次提前五天，相当于两个月三次大姨妈，吃止疼药也没用，受凉一直疼。而且带环的时候我还是抱着孩子去的，是我妈妈和我去的，没有人关心，摘下来的时候不知道是疼哭的还是气哭的，为了这么个人受了这么多罪真的不值，而且我离婚了。以后再也不会带这个东西了。,242
作为偷偷吃过一段时间长效避孕药的已婚女性，对这个话题很有感触。我目前不想生孩子，我老公非常迫切的想要孩子，虽然在我要求下他会戴套，但是在几个月内发生了三次套破裂的情况。虽然我都马上补了紧急避孕药，但是真的很不放心。吃短效吧我真的记不住，而且放在明显位置再上闹钟就会经常被他看到，他每次看我吃紧急就很不开心唉声叹气的，不想每天都因为这件事闹不愉快，很影响心情。我就想到了吃一次管一个月的长效避孕药。查了一下包括六老师在内的一些医生都说长效避孕药副作用很大已经基本淘汰了，但我附近的药店能买到，我就还是吃了，计划之外的怀孕造成的被迫生育或者被迫人流要可怕太多了，我绝对无法接受，所以相比之下我不在乎长效药那点副作用或者对生育能力的损伤。而且长效药确实便捷性和私密性比短效药强多了。所以希望相关领域也能再研究改进一下长效药，毕竟都是一个月一次，吃药还不用跑医院不用扎针，方便多了。如果六老师能够看到评论也希望能解答一下现在长效药是不是还有很大副作用，因为我服用期间除了有不规律出血没有其他不舒服。虽然我现在也用不到了（正在离婚冷静期中），希望能对其他类似困境的姐妹有点帮助吧。,485
作为男性说一句，必须离婚,12
作为男生想对女生说千万不要找超过自己年龄5岁的男的，在他眼里你只是猎物，已婚的会权衡利弊绝对不可能为了一个黄毛丫头离婚的,60
作为男生告诉你们，是怀孕还是打胎要看男方条件，如果男方条件一般，肯定优先打胎。如果男方条件相对比较好，可以考虑生下来，参考张碧晨携娃上位。 对于有钱男性来说，如果不想被动，一定要做好避孕，因为女性有完全生育权的，不然等着出抚养费吧。,116
作为男生，想劝各位妹子，不要激动，男性的生理结构天生决定了我们无法体会你们的痛。我自己腰突后，才真的理解我妈腰突坐站都不适的那种感觉。如果有条件，就像up主他们一样带你们丈夫去体验生娃的模拟痛苦。因为不曾发生在我们身上，所以我们真的会有做的不好的地方，你们可以先告诉我们一次，后面你们的老公要是是好的，会学会的。还有就是，不要因此就对男性和婚姻和生育充满恐惧，张大双眼认真挑选，有合适的并且自己想清楚了就去争取，当然也不是非要结婚生小孩不可，只是说你们不要在没想清楚前就因为担心和恐惧直接杜绝一切看可能了,252
作为男的。 我奉劝各位女性朋友好好爱惜自己，如果没有生育的打算，那么避孕措施是必须。如果男友坚持不做避孕措施，那么建议你分手比较好。因为你对他而言就是一个泄欲工具。 恋爱和婚姻有不同的地方，但也有相同的地方。不同的地方在于后者需要承担更大的责任。相同的地方也是双方都要给予对方尊重。,141
作为妇产科规培医生给大家科普一下吧，大家也不用太害怕哈哈哈。孕14周以前算早期妊娠，一般这个时期的自然流产大部分都是胚胎染色体异常导致的，算是优胜劣汰的过程，后续还有生育计划的会建议把流产物送去做染色体相关的检查。up主这个孕周胎盘已经开始形成了，而且是稽留流产，比活胎去药流的粘连概率更大，所以胎儿样组织排出后还得等胎盘掉出来，不像7周之内的药流看到绒毛组织掉出来就行。,186
作为80后，因为我并不认为未来几十年普通人会越过越轻松，甚至更悲观，所以作为三娃爹的我，如果未来我的孩子选择不婚或不育，甚至直接出家去追求精神追求，我起码能不反对。,82
昨天和好友聊天，我们聊了很多，就聊到生孩子的问题了，我身边很多人都是因为孩子而结的婚，再者，我身边奉子成婚的也很多，婚内出轨的也有几个，我都看在眼里，没下班的时候我同事昨晚和我聊天，她想离婚，她丈夫用孩子道德绑架她，不肯离婚，说离婚了孩子怎么办，她说，我又没死，孩子照样能照顾，直到现在分居了，她丈夫一直在求和，她只能这样耗着。我们闽南这里有些人真的很看重子嗣，只要有孩子，结婚也好，不结婚也罢，孩子生下来就对了。,207
尊重祝福。国家不是提议三胎吗，我的名额也捐给你们，尽一点微薄之力，加油,35
尊重他人命运 放下助人情节 不离婚给隔这儿拍视频,24
尊重、理解、支持这些词汇，只有网络上存在！我今年29，亲朋好友同学都结婚了、离婚了、二胎了、二婚了，唯独我一直单身，哈哈……很多问题我不问，但是我也有答案，不外乎都是女人到了这个年龄就该结婚生子了，迟早要结婚的还不如早点，身体恢复快，趁年轻找个条件好的结婚，有的是他条件还可以，越挑剔年龄大了越难找好的……我从心底觉得我可能一辈子一个人了，挺悲伤的😂想法就像藏猫猫，想法隔段时间不一样。最初想找个心爱的步入婚姻，后面看多了律师咨询、网友投稿、群友吐槽，发现男人都很鸡贼，诡计多端，后面很想找几个志同道合的姐妹一起单身到老进养老院，发现也不可行……悲伤，太悲伤了。反正我现在已经不敢回村了，亲戚都已经忘干净了，都不知道喊啥了，我大龄未婚已经村里➕隔壁几个村都出名了，就差镇上也快了，门槛都踏破，还有人说我这么漂亮又不恋爱又不结婚，啥有啥毛病。艹,371
最主要原因是为国家长远利益考虑：一个国家年轻人越多就越有未来！而美国白人女性本来就生育率低，再允许本来属于女性基本人权的堕胎合法，那未来白人新生婴儿的比例会越来越低，即便美国可以通过移民来实现美国人口年轻化（同时美国变得越来越有色人种化，即美国越来越像是拉美国家，这是以特朗普为代表的白人群体所不愿看到的）所以为了所谓的国家未来的竞争力，践踏基本人权价值观也是可以的，这就是美国！,190
最主要原因还是吧，生孩子是为啥？养老？（搞笑的，见过家里老人去世几个儿子分钱开心得想放鞭炮，一点没有父母去世的难过，如果能跟儿子住，也不至于去养老院） 其二：还是经济问题，我个人家庭条件较好点，但是也不想生。自己国企上班，老婆当老师。父母有俩家小公司…,126
最主要的是公务员人数太多太臃肿，2019年已超过了3800多万(包括事业编的公务员3100万)，不包括已退休的900万，相当于30多个农民工养一个吃皇粮的(37:1)，2019年的美国是190:1；2019年的日本是150:1；中国古代汉朝是8000:1；唐朝是4000:1；明朝2300:1(注意:可不是800:1与400:1与230:1)。所以现在还能精简多少人，大家心里都有数了，精简问题解决了，什么样的养老金问题都解决了。再减少贪污腐败行为，对金融行业的高薪及高退休金进行重新衡量并降薪，既能解决养老金问题，更不需用推迟退休年龄的方法损害最大多数工薪族的合理利益，而且还能够解决地方的债务问题！还有，只要把35岁(40岁或45岁)的就业年龄歧视彻底取消，中国就永不缺劳动力，就怕后面还有越来越高的自动(智能)化技术与人争抢工作岗位！因为谁也无法保证这不会导致越来越多的人失业！,392
最主要的是，不能让别人干涉女性的生育，不能让女性失去选择的权力。可以不做，但不能没有选择的权力，有选择才是自由。总是有一些人高高在上的说教，忽略那些被淹没的悲剧，但是如果反对堕胎的人她自己遭受意外不幸怀孕，而不是和对象在幸福中孕育的孩子，她也会想堕胎，这跟每个人都息息相关,136
最新一期没了，结合失业率和人口率的统计新闻，太怪了,25
最让人很难理解的是，所有人都在庆贺“获得一个新生命”和“高度赞扬母亲的牺牲和伟大”，这导致很多像我妈妈这样的人劝我结婚生育的时候，给我描述生孩子这么大的事情就像是吃一顿饭那么简单，还反觉得我“大惊小怪”。以前的女性都已经这么默认“生育是一件理所应当不应该拒绝甚至害怕的事情吗？”,139
最美的礼物先问问父母原本是不是想养第二胎啊。疫情失控带来的种种障碍酿成的结果被这样美化了，鼓励生育也不带这样的,55
最近三四年不想生的太多了，导致生育率猛降，祝想生的都能如愿怀上健康宝宝，不想生的也要注意了，现在抓生育率，管你单身还是考研什么的，可不是想流就能流的,74
最近刚刚从这样的焦虑中稍微透口气，但是生过宝宝以后，对这件事的焦虑就一直没有消失过，之前和伴侣长谈过有了很大的缓解，但是每次月经前后每次同房过后都还是会焦虑，补充一个六老师视频之外的一个压力来源——家人，虽然家人没有当面给过我们关于生二胎甚至多胎的压力，可是交流中不时透出来的对于多一个甚至多个孩子的希望，还是会让我担心意外出现的时候会因此影响和家人的关系,178
最后是要离婚吗？我只能说求之不得。,17
最后米兰昆德拉的话，从侧面说明一些人不想生的原因：害怕自己看到的一切被重复。,38
最后结尾这个引用我深有体会，当我是一个学生，没有固定收入青春期经常跟爸妈吵架的时候我是坚定的不婚主义者，但是我现在有了稳定的工作，房车对我来说也不难的时候，我开始期待一个小生命、期待我的血脉得以延续……即便我很怕疼，也还没有男朋友,115
最后的bgm是日剧《最完美的离婚》里的插曲，哈哈，不知是否也有这层期望在里面,38
最好是流产之后不能生育了,12
最好的负责，是洁身自好！守住贞洁！那些传播“现在还有多少处啊，这不正常吗？”这种话语的不是坏就是蠢！非处传播是因为她想让别人和她一样烂，这样她的竞争压力就小，男的这么说是因为他本身就不是个好鸟，想着更容易泡到妞！ 女孩们，记住，你最大的宝藏是你的贞洁！莫要听那些阴险狡诈之人的污言秽语！,143
最好不要吧，高龄产妇,10
最根本的问题，一是文化水平高了，五六十年代生育高峰期的时候文化程度是什么？娱乐节目少，没电视没手机，没事就生孩子呗！文化水平高了，就变了。二是养育成本高。原来生了一群孩子放养，现在得精准培育。三是生存成本高。原来一个人工作全家就够了，现在两个大人工作未必就宽裕。原来一只老母鸡能供养一个大学生，现在不够一顿请客的饭钱。四是城市化进程过快。原来的生育大军在农村及县城，现在农村实际居住人口平均年龄得70岁吧，都去城里买房子了。地谁种？！,217
最搞笑的是，我们这静默1个月后，我去区大厅领号办业务，看见排队最多的是离婚申请，结婚窗口只有1人拿号排队。呆在家里1个月，互相嫌弃，哈哈,68
祖辈生了7，8个的比比皆是，父母辈也有多子女的，排除独生子女政策，我是70后也没听说谁怀孕艰难，现在的年轻人好多都有生育问题，身体素质差还是什么原因导致如此困难？,81
总之就是一句话，没做好生育准备就不要怀孕，不想生的麻烦做好措施，别到时候伤身伤心了就开始抱怨，成年人了自己的事情自己负责。,61
总之，如果不想生宝宝的话，就做好科学避孕，对女性的身体好，对宝宝也好，对不想当爸爸的男同胞也好。一定一定一定要做好科学避孕呀！ 我想，任何期待新生命的父母，不出意外都不会在20周的时候才去流产，那为了孕期健康，也要在生育之前做好准备，在可以迎接宝宝之前还是要做好科学备孕呀 祝福每个想成为父母的人都顺顺利利，每个想享受个体人生的人也都平平安安,171
总有劝我结婚生育的我说“我不喜欢撒塞”,19
总结：想离婚但舍不得钱,11
宗教是我一直无法理解的概念 我在这里讲，我现在处境不好，没办法良好的养育孩子，所以暂时不想要。或者因为某些意外，而现在的我没有能力养育这个孩子。 而宗教却告诉你，孩子也是生命，即便是胚胎也是有意志的。他们却不告诉你，被强暴时施暴者为什么会犯下罪孽？孕期母体要遭受什么样的罪，因为孕期耽误的工作怎么养活自己，婴儿的抚养费，教育，生活质量，他们都不会管。他们只考虑他们自己相信的，不会为别人考虑，就是所谓的“自由”“人权”,209
宗教，保守，种族歧视，狭隘的利益，人真的可以很坏。,25
自然界所有物种，只有人类生育有难产而且生产艰难，只能说明人类基因退化的可怕，不符合自然规律。,46
自己的生活质量和养育孩子两者之间做选择每天两点一线的生活，已注定没有选择,36
自从有，因为想当精致的猪猪公主，跟丈夫离婚，抛弃儿子，跟网恋网友出走。这种离谱的人都有，还有什么没有的,51
自从我学医以后，就不想要孩子了，我周围的同学也这样想的，她们要不就丁克，要不就不婚,41
自从我结婚以后，我就发现周围好多这样的，我说两个吧 第一次接触是我老公他老家那边的某个亲戚，山东某个地方，远方表叔吧，之前表叔自己谈了一个对象，结婚后没能生孩子，具体的我也不好意思问，然后婆婆就各种各样的插手吧，最后离婚了，找了第二个老婆，没领证，先生孩子，生了儿子，儿子两岁多才领的证，我第一次见面的时候，感觉那个表婶估计跟我差不多大，反正我对那一家子感官不是很好，不过表面功夫还是要做的 再之后听的基本上大同小异，第二件给我印象深刻的是这种事情居然发生在医院里 一朋友在医院里当护士，听她说的，一护士跟医生结婚了，结婚几年一胎是女儿生下来了，二胎三胎检测还是女儿打掉，第四胎的时候还是女儿，女方受不住了，这事儿估计闹的他们医院里都知道了，最后的结婚就是离婚。 所以说不要在垃圾堆里找对象，要么别找，要找的话，也要保证自己不被pua，或者脱身 我只能说，自从国家开始普及教育之后，越来越多的女生明白一些道理，一些原因，至少生不出儿子，不都是女方的原因 感谢国家,431
子宫是女生独有的权利，这个器官长在女生的肚子里，女生就应该拥有决定自己生与不生的权利。离婚冷静期是有多种解释的，有的人是冲动结婚、冲动离婚，但是离了之后又反悔，这个有的时候能避免一些问题，如果只是民事诉讼，这个没有问题，但一旦涉及刑事诉讼离婚，法院是会直接判的。,131
资源向一点集中这件事株洲人表示有发言权。早年间从北京地区到广东地区的高铁建设基本确定是要从株洲过的，但因为上级表示要发展省会城市，就硬把线路拉到长沙去了；近几年也是，原本一直在株洲建厂的中车集团突然打算把一整条产业链转移去长沙，具体原因我不清楚，但实际情况就是株洲的就业岗位又下降了几千个；说这些话没有别的意思，就是想抱怨一下，现在的产业分配真的越来越向中心城市走了，小地方没有资源就没有价值，但了不起的人们却一开始就把这些资源挪走了，现在发展不起来还要被人说是不努力，真是醉了。,240
资本家面对300%利润就能藐视所有法律，但是彩礼连成本都不需要的超高回报率。而且还能离婚简直是无本买卖,51
资本家把人当猪。但人有智慧，自己知道这样，还会生育下一代继续为你们资本家服务?,39
资本才是最大的推手，教育焦虑必须叠加上金钱至上和享乐主义才能产生出低生育率。要是人们不想着自己享受，都愿意吃苦养孩子，生育率就不会低，以前的农村就属于这种。另外不能忽视千禧年以来金钱至上的理念占据上风，想要平平淡淡过完一生的的人几乎没有了，大家生出来的孩子一定要能赚钱，不赚钱就是失败的，痛苦的，形成了一整套闭环逻辑。,159
