cleaned_text,text_length
很多人不是在劝大家不生孩子，只是很多都在说，对家庭不负责任的伴侣会让人多失望，女性生育的风险，谴责把生育和女性绑架在一起，不生孩子不是女人，不生孩子人生不完整。当然也不是说生育没有好的一面。想生的还是会生，不想生就不生,109
很多人不清楚事实真相，然后一直抹黑当事人，说什么睡太多都不知道父亲是谁，就挺恶心的。就事论事的话，我愿意先同情当事人，也可怜刚出生的婴儿。我自己上学的时候也犯过蠢，天真的爱情至上，当时的男朋友就是一脸痛苦的表情要发生关系。我让他买避孕套，他不肯去，然后软磨硬泡好久还说不弄进去不会怀孕。我相信了他，可是他没有那样做，然后一句轻飘飘的话说他忘了。忘了？！那是人生第一次发生关系，也仅仅发生过一次。我吃了紧急避孕药，还是怀孕了。当时没有经济能力，没法要，只能做了手术。而那个在发生关系的时候一次次说他一定会娶我的人，也如同当时骗我一样，没有履行诺言。从此以后我就成了不婚族，我原来是不厌男的，现在就下意识非常讨厌男的了。虽然咱机智觉得不对，但还是信奉，不要靠近男人会变得不幸,335
很多人并不想生到这个世界上。比如那些被霸凌的人，缺爱的人，患病的人等等，不允许堕胎是对他们的残忍。,49
很多人辩驳，说女性堕胎对男人的影响，实际上堕胎的实际情况往往是因为胎儿不被男方或者家庭所期待的，生出来也没有办法得到很好的支持。如果真的像很多评论里那种所谓男方很期待并且愿意养育，女方家人也很期待的，身体健康也能支持生下孩子的情况下，又有多少女性会主动放弃自己的孩子呢。电视剧里那种怕生孩子影响自己事业什么的，毕竟是少数，大部份人也知道自己的生育适龄是多少，这个窗口期没有那么长的，女人是必须要在事业和生育作出抉择的，男人不需要，所以多听听女性意见是很必要的。,230
很多人“避孕”就是用什么安全期、体外，那些根本就不是避孕！还说什么易孕体质，不做措施不就是备孕吗？就那种错误的“避孕”方式，不怀孕才奇怪吧，有可能是生育能力不行,80
很多女人，不是全部，都是备孕就找个公司工作，然后怀孕生子后，带薪休半年产假，回来工作后一个月就辞工，然而，这种现象钻空子只多不少，害到的是刚出来工作的女性，更多企业都是问有没有生孩子，生了几个孩子的女性职员了。 女权重要，但钻这空子，搞得一些公司不敢招聘未婚未育女性，然后又说歧视女性，这就是一个恶性循环。,153
很多年前看过一个美剧，妈妈不想生孩子了，爸爸就自然而然的去结扎去了，挺和谐的，女性在性和生育方面付出太多，不应该在节育上再受伤害。,65
很多男性朋友指责？都是男性指责吗？你自己就是男性你指责了吗？普世的价值观不应该是 :你自己做了选择，连累到了孩子，孩子没有选择。在一个你没法负责的年纪生育，对自己不负责对孩子不负责，对于这种事情更多的是觉得痛心，你要重新定义一下 指责 的含义了，这件事给我的感觉只是 一件 违背了普世价值观 的怪异事件，不存在指责更不值得提倡，而且所谓的女孩子缺乏性教育，大学生了，还要怎么教育呢？我不反对性教育，但是我反对一出事就说缺乏性教育，大学出事提前到高中性教育，高中出事提前到初中性教育，初中出事难道还要提前到小学性教育？更多的不应该是价值观的引导吗？另外说个题外话，我讨厌哭唧唧的男性，尤其中年，男人应该硬邦邦，顶着天立着地，因为这种事哭唧唧会让人觉得好像犯了一个很大很严重的错误，既然生下来了就养，只不过日子苦点。,356
很多男生就是这样，他们不理解怀孕期间以及生产之后女生付出的代价，他们体会不到，因为难受的不是他们。所以更要把这些“真相”说出来，让更多的女孩子是在真正想清楚之后再要宝宝，而不是被所谓的“生育责任”、“传宗接代”这样的枷锁PUA,113
很多男的有病他自己不知道，但也有的男的知道自己有病，他会赖女的身体不好，我前夫就是有病他死不承认，让他看医生他不看，最后撕破脸不看医生就离婚，他宁肯离婚也不看医生。这种男的最恶心！,90
河南生育率很高吗,8
和我闺蜜情况一样。她是大学期间那个男人不愿意离婚娶她，通过和别人谈恋爱，硬生生分开的。小时候不懂事，觉得她敢和那么大的男人谈恋爱，而且婚外恋，既禁忌又酷。现在懂了，只能尽一切努力和她一起欺骗自己。让她一直以为自己只是谈了一场痛苦失败的恋爱，而不是被诱奸。否则身为被害者的痛苦会吞没一切。,143
和他离婚再找个老公生个娃抱着天天去前夫家附近溜达玩,25
和男朋友丁克，说好结婚前他去做结扎，其实我还是有点心疼他，但是女性结扎是比较大的手术…只能让他辛苦一下了,52
和老婆高中就在一起，婚姻美满，二胎如期而至的我，点进来干啥,29
何止是离婚，得报警了吧，这也太刑啦。我的心灵又得到了冲击,28
好真实啊…男生没有生育的压力，也不会关注这些，也没人愿意参与研发，有些东西一直以来都被大家选择性看不见…哎,53
好消息，刚刚看了这个视频主人公的ins，她已经有二胎啦,27
好像现在经济下行，这行业竞争很多，收入一路下滑。 看报道的，好像有的一次折合人民币才一二百？,46
好像觉得所有人都是被女性养出来的 所以理所应当的觉得怀孕即使很痛苦 但是你看大多数女性不都是活的好好的吗忍一下都可以熬过去的 可是我是一个单独存在的人 我为什么要和因为这些“规则”去养孩子呢 告诉女性生育有多痛苦这是正确的 就算这很恐怖那又怎样 这方面的知识需要普及到每一个细节 让女性可以是一个全方面了解生育带来的麻烦的时候再决定要不要生孩子 我现在还比较小不能对婚姻甚至生孩子有太大的共情 也谢谢up让我理解到生育这个课题 如果我要是生孩子的话 我可能会让另一半全程陪着我经历这些 他也不能觉得麻烦像是个任务一样 我希望他打心眼心疼爱护我自己选择陪着我 要不然我为什么要和你结婚,291
好像还有后续，大儿子媳妇受不了婆婆打胎离婚，二儿子女朋友怀孕了说婆婆不打胎就不结婚，婆婆已经失去了个孙子不想再失去一个孙子，打了胎，但二儿子女朋友已经看清了这家人啥样，就打了胎分手，婆婆气的死了，家里只剩下三个光棍,107
好像大家都在为这类男人找补，说什么他们不能共情，没有真正的感同身受。不可否认，世界上确实没有真正的感同身受，他们确实没有经历过那种痛，怎么可能真的代入自己？但是，我们从小到大，不都是会接受恻隐之心的教育吗？一直以来，无论是书籍还是娱乐、新闻，宣扬的都有看见战乱中流离失所的人们、看见废墟中号哭的孩童、看见失亲失友的离乱者，我们都要有恻隐之心，要有心疼之意。 对于生育，我们顶多只学到了，母亲生孩子很痛，要尊重母亲，但其实这不是在唤醒人类的恻隐，只是在强调“孝”，就像“爸爸妈妈很辛苦，要孝敬他们”一样。在尊重母亲这里，强调的不是人类对待人类的共有之情，而是，身份之间的态度。 所以大多数人不会对生育之中女性受到的苦难提起更多的重视，他们尊重的是那个被强加“伟大”的身份，但是，在这方面，女性首先是人，对同族有恻隐之心，难道不是最基本的吗？ 看到妊娠纹，看到生产过程，当然会有人害怕，也会有人被吓到晕倒，这是人类恐惧的本能。就像看到残肢断臂，看到身有残缺者，最先会有悚然感，但是惊惧之后，应该是有心疼，心疼于苦难集于一人之身。怎么会有人，因为见到过有关生育的真实面，就因此对生育者产生嫌恶感呢？嫌恶当然可以，但是嫌恶的应该是苦难本身，而不是因此嫌恶人。有这样想法的人，还算是人吗？ 人们恶心屎尿屁，但是会因此讨厌一个有这些正常功能的人类吗？（有这样的极端者，但是一定很少） 大多人，愿意去心疼一个陌生人的流血，却不愿意心疼半只脚踏进鬼门关的产妇，还要用“无法感同身受”来为自己开脱。没有求着你一定要感同身受，共情确实很难，但是你的人性呢？需要的，是心疼、尊重、理解,681
好喜欢enj那段关于生育来讲并不执着于生一个有自己血脉的小孩，觉得领养也很好。因为在她看来资源的分配是不平等的，大家都是人类，养什么样的小孩都一样，并且觉得后天的条件环境资源比先天的一些东西更能去塑造一个人。 我以前从来没有在这方面想过 很感谢enj！会带来一些我以前从没思考过的东西,142
好傻啊这个女生 直接上法律手段告他啊 这种男的律师还劝和 劝你妈 早点离婚对这个女孩不是一种解脱吗,49
好奇怪，想生就没必要人工流产，不想生就做好避孕，这到底是想生还是不想生啊,36
好恐怖，还是不结婚不生育好,13
好可怕，又多了一条不想生育的理由，初高中发育的时候腿上和膝盖处留下了生长纹，有时候自己看起来都觉得狰狞，更别提这种纹路长在肚子上了，选择成为母亲对于女性来说真的付出了巨大的牺牲无论是身体上还是心理上。,100
好可怕(இдஇ; )我知道我们国家医疗比他们先进很多，但是生产的痛苦我还是觉得太可怕了，所以我选择不婚不育,53
好久之前的事了，抖音里有所有后续。这个是因为公婆没有经济来源全靠他们一家照顾，家庭条件也不富裕。她家是老大，老二没结婚，生了老三基本就是她来照顾。而且她婆婆并不是一开始就说自己怀孕了，好像是瞒过三个月之后才告诉她的，那时候她都怀老二六七个月了吧。她老公还听父母的，一点也不心疼她。因为这个事一直吵架导致她二胎胎心不好。后来她带女儿回娘家了，要跟老公离婚，结果她老公带了好多人来他家，吵架之间应该是推搡了一下，反正是到医院生下来胎儿就没心跳引产了，后来领离婚证还被前夫一家打了。然后因为这个事二儿子订了婚又退婚了，后来二儿媳发现怀孕了又回来了。因为二儿子不同意生老三，说生老三自己就再不回家了，她前婆婆又把胎儿打掉了。没多久她前婆婆就因为身体原因去世了。,326
好家伙，我媳妇儿是每次都不愿意让我戴，我都说了没有计划要二胎了，就是不愿意，我说戴，她就不要了,47
好家伙，叠buff这是。我有好几个亲戚也是未婚先孕，年轻草草的结婚，孩子六七岁半打不小的时候家里一地鸡毛，又是欠债又是没工作，最后都是落得闹离婚的下场。结婚需谨慎！！！,84
好家伙，彩礼带回家，孩子跟你姓，家务我来做，离婚净身出户，绝了。这得多损啊,37
好家伙 最后这个话锋一转直指三胎我是没想到的,22
好家伙 搁这里跟母猪比生育能力呢 这种人多了，怕就会劣币驱逐良币了 果然 女拳就是一坨屎,44
好好爱护自己，现在想生一个健康的宝宝不是那么容易的，怀孕胎停两次了，听大夫说现在这种状况太多了,47
"好多评论都在说要让男生多看看。。。 心疼你的男生根本舍不得发生婚前性行为，即使发生了，也是会戴套或者采取其余措施的，假如真的意外怀孕，他会想尽办法取得双方家长同意尽快和你结婚，而不是闹失踪拖时间。 男生是无法完全共情的，因为意外怀孕提心吊胆堕胎的人不是他。 如果意外怀孕了，所有风险都是由女生承担，在生育上，就是这么不公平。所以女生只能自己心疼自己，永远不要指望别人。 婚前性行为，当然可以，但请做好相关措施，要知道后果:意外怀孕/传染病（能通过性/血液/皮肤/唾液等途径传播的）。 如果怀孕了，请去三甲医院及时检查，宫外孕会死人!!!如果要人工流产，趁早!!!并且找人陪同!千万不要所有事情自己扛!然后好好养身体，牢牢记住这次教训。 虽然性是自由的，但是不建议频繁换性伴侣，你不能保证对方的身体是否健康，很多病无法根治!!!（一直很好奇如何健康yp,做之前来个全套传染病筛查?）",390
好打，十年了，吃人家的喝人家的就算你不乐意，你至少得赔个笑脸吧，不想生孩子，又不好好过日子，那要你干什么？,53
好惨，好可怕。我害怕，我不想生孩子,17
好不容易刚找到工作这个，真的很叹息，怎么解决育龄女性就业这么困难的同时，应对这么大的生育压力,46
韩国厌女可以说和就业关系很大，但是真的只是因为女性越来越优秀吗，个人觉得和兵役有很大关系，试想一个毕业大学生面临两年兵役，是否有公司愿意去招，更不用说同期女性有充足时间来适应职场。而且韩国的内卷导致近乎半数的年轻人选择考公务员，这其实更加剧了就业市场的内卷化。之前听说韩国兵役可能要延长到3年，那绝对是灾难。,154
韩国太内卷了 人为了上位 都不喜欢做人了,20
韩国生育率世界倒数,9
韩国女性不想生男孩是有依据的,14
韩国的正常女权与极端女权如果真能像你视频里一样择得这么清楚就好了。女性就业和地位弱势是事实，但真不一定说这是男性压迫的结果，中国的男性被压的喘不过气了，如果性别真能对调，女性真的能承受社会对男性施加的固有观念吗。,106
韩国导演也是有毛病，以为美化这种不负责的行为可以提高生育率只会让人更加畏惧生育，无所谓，韩女已经给出了答案,53
害，我跟我对象说的很清楚，婚后生育完之后决定不要了，要么他带一辈子套，要么他结扎，上环啊我吃避孕药啊这些想都不要想，反正带不带对我来说没所谓，他自己取舍,76
害，不婚不孕就不会,9
害 我表姐也是 结婚好几年想生孩子却一直没怀上孕 北京成都各种妇产医院都去过了 折腾了5、6年 本来青春靓丽的姑娘现在也有点发福了（但依然好看） 前年暑假她来我家做客 跟我说她怀孕了 我当时就想哭得不得了 她备孕这么多年真的是我不敢想象的心酸 我的小侄女儿已经1岁多了 我姐姐现在很幸福 恭喜up怀了双胞胎 母亲真的很伟大,161
孩子应该也不想过不太幸福（病痛，病弱，贫穷，身心压力，智力缺陷，身体残疾等等）的一生。其实说实话，还是尽量做好备孕和孕前检查，孕期检查，听医嘱，尽量确保能没问题最好，想生的话做好真正的“优生”比较好，这样父母孩子都能更幸福一点。正常来讲很多问题孕前期就能看出来，需要引产的医生肯定早就说了。至于真到了难产这一步出事了，那真的是没办法了，不要那还是人吗？,176
孩子应该是在全家人的期待下被诞生的，并且是在家里经济情况允许的情况下。前段时间看了生门这个纪录片，有些产妇家里经济条件不好，生下来却没钱养。甚至因为没钱，在生产过程中遇到问题只能选择保一个，孩子生下来住保温箱也没钱买药治疗。相反的、有些家庭条件好的、因为产妇身体问题只能做药流。也是因为那个纪录片知道了瘢痕妊娠。我是二胎，我妈36岁才生我。01年出生在南京市妇幼，当时是不能生二胎的，我爸为了生个女儿，托关系找人、带着我哥去医院开证明说他有病，办下了准生证，然后我妈取环怀孕生了我。那时候我妈是高龄产妇，我爸为了保险，怕生的时候大出血或者出现其他意外。有托关系找医生在市妇幼开刀、我妈生我哥的时候是顺产，但生我时间隔的太久只能剖腹。我到现在都记得我妈说她生我的时候就感觉医生像用指甲、在她肚子上一道一道划，然后感觉肚子就开始漏气。还好顺利把我生下来了。她说她生完我之后吃了好多补品才养好。我姐（嫂子）现在也生了我侄子，别人都问我妈，媳妇生不生二胎，家里条件这么好。我妈每次都说随便他们。我妈真的是那种很好的婆婆，从来不插手我哥和我姐还有我侄子的一切问题。大家真的要想好了再怀孕，尤其是未婚先孕。生孩子一定是自己想生再生，而不是被逼。女生生来不是为了生孩子的。家里有钱、或者为了生儿子这种话都不应该成为催生的理由。孩子生下来是要对他负责的！不管是生产还是人流，对女生的身体伤害都很大。另外推荐所有的男生女生都去看看生门这个纪录片。看完真的感触很大。,623
孩子是上帝赐予的礼物？那母亲也是上一次神降下的礼物，同等神格为何不能主宰另一个神格，神不是万能的吗？逻辑谬误 而且处置堕胎权并不是问题的根本，，而是并没有分配给女性足够负责的另一半、已经足够让养育子嗣的环境。如果生育环境良好，谁又不愿意世界上多一个小可爱呢。,129
孩子没生出来之前应该算是妈妈身上的一个细胞组织，那既然是妈妈的就可以让妈妈来决定去留。而出生后孩子是独立的个体，他能不能活下来就是他自己的造化了。（我是个妈妈，但是不想让我女儿生孩子，因为养育比生育更难。）,103
孩子没了是好事……赶紧离婚啊,14
孩子交给男方父母，离婚，回归校园好好学习，提高自己，不要存在任何幻想，快到斩乱麻，不然一辈子就完了。 我觉得我说的这几点这个女孩儿一样也做不到，好吧，她这辈子大概率就被这个渣男毁了。,91
孩子祭天，法力无边，前途无量后面妻子心死离婚是不是还得歌颂为了学生放弃了婚姻,38
孩子估计自己都不想生在这出生家庭直接自己走了,22
孩子对一个家庭是重要，但不代表没有孩子就一定不幸福，有孩子就一定幸福，身边有刚生完孩子就离婚的，我立刻不羡慕她了，一切都顺其自然吧，关键是自己活的舒心,75
孩子的爸爸不会有什么审判的，男人没有生育权，播了种是生是流都是女人说了算，这受法律保护，但是相应的，女方生下来掐死，实际上是她的责任，如果让男人一方面没有决定权，一方面又要承担这种事的责任，我觉得不合理。,102
孩子打掉 离婚就对了 姑娘千万不要心软,19
孩子从胚胎开始就等于是母体寄生虫，吸收母体养分，抢夺母体资源，没出生的孩子本就不应该叫人，母体一部分罢了，还给母体造成巨大伤害和折磨。母体拥有百分百生育权这个事实根本不需要讨论。,89
孩子本身就在女人的子宫里 男的能跑 女的跑不了 这就是为什么往往女人对孩子承担更多的责任 从反面来讲 对于孩子的处分也确实应该归于女性 不管男方死没死 女的想生出来男的不要就自己养 男的想生女的不想要就可以打掉 如果连这种权利都没有 女生的子宫都是不属于自己的 欧美国家支持代孕但是禁止堕胎就是流氓行为,151
还找什么记者调解，直接离婚好了,15
还在考虑离不离婚，可真是不清醒啊,16
还有人在这玩道德批评，过两年生育率持续下降，看看你们敬爱的祖国怎么说吧，还中国道德，搞笑呢，现代国家所有的道德都要为国家利益服务，迟早变成央视主动鼓励女性怀孕，管你结没结，先延续后代再说，社会化抚养才是未来。,104
还有男的怕结扎了变得弱柳扶风，干不了体力活，笑死，有一句话叫瘦死的骆驼比马大，那体格那骨架肌肉在那摆着，再弱柳扶风也比女的体力强，没有见哪个女人说因为体力弱在这个社会活不下去啊？现在的时代需要他天天冲锋陷阵吗？ “我体力变差，可能失去生育能力”和“老婆肚皮开刀，经历风险不小的手术，一次不算快的恢复过程以及较剧烈的术后反应，永久失去生育能力”，他选择后者,177
还有第三胎等着你。。。,11
还有本小说女主被男主囚禁期间发生关系，然后女主逃出来了，但是过马路的时候被车撞到了男二正好出现救了她，女主醒来发现在医院忙问男二孩子呢，男二悲痛的说流掉了，女主悲伤的不行，男二马上说不过你怀的是双胞胎流了一个还有一个,108
还未成型的孩子是生命，但是却不提怀孕中的女性也是生命，她们是已经来到这个世界上并且享有人权的，难道她们的生育价值比她们自己都重要吗，合法杀人，难道不是吗,76
还是祖国好，可以免费去计生办拿。不知道现在开发二胎了，有没有免费,32
还是早点生了好，等到了二十多到了结婚年龄思想成熟了既不想结婚更不想生育了,36
还是一个问题，生育是头等大事，但是两性知识却嗤之以鼻。,27
还是瞎了好，瞎子好了之后第一时间就扔掉拐杖，这剧也真实体现了，花儿眼睛好了之后就开始各种嫌弃那个为了治好她眼睛倾家荡产的三斤，男人没必要当这种烂好男人，只要不亏待就行了，要优秀也是把自己变的优秀，将来就算离婚，自己也不亏,110
还是生育率太高了,8
还是那句话，生育权在女性自己身上，堕还是留都是女性自己的选择。两者的风险都了解好，自己想清楚就好，听别人没用，日子是自己过的,62
还是离婚的好这种独生子跟他老妈有那种激情的爱,22
还是建议女生不要上头就结婚生孩子，我亲姐有个两岁的儿子，然而我的姐夫还在读研究生，因为疫情拖了两年都没结婚，我姐生孩子前后的状态真的差别太大了，因为疫情我姐夫一直在上海，我姐带着外甥一会住丈母娘家一会回我们家，因为我姐脾气很爆又护崽，所以她挺讨厌姐夫家人又跟我妈不对付，一个人带崽也没法工作只能天天待家里接游戏单子，我妈劝过很多次让她出去工作孩子给姐夫家人带，因为在我妈看来姐夫读书不养孩不出钱，完全没尽到责任，今年实在受不了了就打电话说了姐夫让他管管家里，搞得我姐好像单亲妈妈一样，要不是我家有点钱还真养不起 我家人还算比较开明了，我姐我妈不止一次一起跟我说不要生孩子，特别是我姐我妈是个女强人，她现在也在努力赚钱就是为了以后我们能尽量快乐地生活，还说就让我姐这样没什么烦恼地过一辈子吧，希望我以后找个安稳的工作（房子帮我买好）我妈知道我喜欢动物所以不要求我生孩子，还建议我最好只谈恋爱别结婚我弟的话她是打算培养成接班人的，因为他成绩不怎么好还不如直接跟着我妈先熟悉公司 我很庆幸自己有这样的父母，我爸就不说了最宠我的就是他，他说过最后悔的一件事就是以前打过我巴掌（但其实小时候他实在生气打我事后都会赔礼道歉的）我妈是二婚所以在结婚这方面比我有经验多了，反正她已经当外婆了我生不生结不结都无所谓，而我又是个理性自私的人，也有过恋爱经验，可以说如果我感觉自己被辜负了或者在这段感情中不快乐就会及时止损，对方不可能pua我，我不想生孩子就不可能生，生完孩子觉得对方不负责大不了跟我妈一样离婚，我是会固执地耗下去直到完全离婚的，只要没我家人脉广权势大就都不是问题，所以想要活的好一点要不家里背景好，要不自己打拼出来一番事业，如果是自己打拼来的千万不要因为结婚就放弃了，我妈的朋友都很羡慕我妈这个女强人，不仅有事业还有家庭，当然这也导致我从小被迫独立就是了,775
还是当事人（女方）不坚定啊，调解员劝她就不离婚了。没有调解员之前她不也是在这样的状况下依然怀了二胎吗？根本不想逃离。,58
还是别严打代孕，扫黄了，严打了这俩，无意中助涨了高额彩礼。想开车的500一次，18.8W可以玩376次；想要娃的可以试管代孕生娃，而女方索要高价彩礼，本身就说明她一点都不爱你，不会为家庭考虑不适合过日子，就算结婚了也往往吵架离婚人财两空悲剧收场。正因为没有满足男人性和生育需要，才会有那么多男同胞付高价彩礼被渣女诈骗,158
还年轻，离婚吧，机会就算了,13
