cleaned_text,text_length
生不生孩子是自由，现在很多观念确实改变了。我只想说下以前遇见的网络上的事情，自己不生孩子和劝人不生孩子是有很大区别的，之前有个评论觉得孩子很可爱想生，下面评论是繁殖癌.以后黄脸婆……还有其他恶毒的话，在我们与那个人理论，拉黑后，她用小号骚扰每个和她理论的人。。之后她还发动态说是为别人好，大家都不理解她。。所以说生不生孩子只是个人的事，为何要把情绪发泄到网上，还自以为是为别人好。实际上对别人的家庭情况根本不了解，却胡乱猜忌的人太多了。,218
生不生孩子是个人的选择，但是我希望每一个女孩子在决定生产之前都能了解清楚自己所要面对的是什么情况，不能什么都不懂，什么都不知道，就这样稀里糊涂的选择了生产，中国普通的教育里面没有这一部分，很多人都不清楚，将女性生产所要面对的东西模糊化，这是不对的，B站就有一些科普类的视频，可以自己去找着看一看，希望大家能够了解清楚，再决定去生育,165
生病、尤其是眼睛的问题会导致很大的心理压力，所以最最最重要的是好好呵护自己的身体健康。然后是找一份合适的工作，有很多工作不需要体力劳动的，减少经济压力让未来有保障；不能沉溺于过去的人和事，工作的充实感能把自己从过去抽离出来；去工作，去实现你独特的人生价值和社会价值。,133
甚至有的女性因为结扎而无法生育，而男性结扎没有一点后遗症。,29
沈老师简直是我的嘴替。 我就很想说这个发展权的问题，反堕胎人士枉顾女性的权益去支持胚胎的生命权，但是其实他们也枉顾了胚胎的发展权。一个unwanted的孩子从生下来就不被欢迎，甚至可能被抛弃，如果母亲还面临经济困难，他的发展权很难受到保障。他当然可能成为一个正直善良有成就的人，但是他也可能成为一个悲观消极甚至潜在的犯罪者。而且这个概率我觉得不一定少，因为原生家庭对一个孩子影响真的很大。,194
神来之笔？？难道不是生育机器？,15
什么时候未婚先孕也有这么多人去维护了？版本更新了？只想要权利不想担责任？就业的性别歧视就是这些人自己作出来的。,55
什么时候国产加入竞争来个价格跳水,16
什么迷惑？和初恋在一起十几年还结婚了，不想要孩子离婚了，离婚后和其中一个男友生了孩子？合着你是来报复前夫的吧,54
什么叫自私 女性是生育主体 想和不想都是女性自己决定,26
什么叫私自啊，我真的笑死了。生育是女性独有的功能好不好,27
身体真的很健康，现在好多女的想生都生不出，做各种试管都等于零,30
身边有一模一样的亲戚，结果就是离婚，孩子没人爱，好可怜，性格都有点歪了,35
身边就有超雄男孩 挺正常的啊 反而是另一个正常的男孩很容易暴怒 虽然身边统计学不合理吧 不过还是想提醒一下不要产生歧视…,60
身边都有被绿离婚的 不止国企,14
谁在监听我呀？我今天刚查出来怀上二胎，可是老大才1岁零一个月不到,32
谁想到一个丁克居然快乐地看可妈的视频其实我是想来说可妈那条围巾真的好看,35
谁会怀孕谁去结扎呗，大自然没给男性怀孕的能力，为什么要让男人自己损害自己的身心健康呢？这片土地的laws明确规定男性没有生育权，生育权是女性特有的权利，为什么男性没有权利却要承担不必要的责任？,96
社会性的制定本身就是和人的自然性相抵触的。难就难在有些社会性既不能完全背离自然性，和自然性的抵触又特别的深而微妙:你干脆规定不能生孩子人人都绝育好了。但是又要保证在人类繁衍的基础上保证男人的生育权及其私有性。其实既然反对抵制婚外生育是为了保障男性利益，避 孕的责任也该由男性来主要承担那才合理,146
社会内卷的原因是什么，是就业难。,16
社会对孕妇已经相对宽容，普通人也愿意帮助让着孕妇，就这情况评论区没几个看客支持这孕妇都还有什么好说的？生完两个月又怀孕，这是搁哪儿碰瓷呢？自己不要命，机构也不想承担责任。我姐姐二胎三胎间隔一年出头我都怕她身体缓不过来，她这体质当自己女金刚吗？,121
设想一下，一个14岁的少女被他同父异母素未蒙面的亲哥哥弓虽**，怀上了一个先天性畸形的孩子，由于先天大脑受到压迫，这个孩子智力要比正常人略低并且有明显的体外畸形。由于自由民主的美国法律，她必须生下这个孩子。迫于生活压力，这个可怜的孩子一生下来就被寄放在社区。在歧视和排斥眼光中孤独的存活到了13岁自杀了,151
上医院开点药，路过这个计划生育门诊，看门口坐着几个男的感觉挺搞笑的，又不敢笑,38
上一胎才生完两个月就怀上第二胎，这太厉害了吧，都不给自己的身体恢复的时间，真的会出事的。。。,46
上学的时候老师讲过一个例子，有一个外国女性三胎的，她阴道瓣还是完整的没有破损，因为非常有弹性所以多次分娩从未破裂损伤,58
上了这么久班，兜里没钱？另外为什么要用保险呢，生个孩子难道要天价医疗费？难道失业了就没医保了？不能自己续保吗？发展中国家都能做到的，发达国家不会这个都保障不了吧？,81
上次看还是一胎 现在就二胎了,14
赡养老人的问题也是一大阻力。传统文化中对孝道的要求，结合当前针对养老的经济制度、医疗制度，乃至看护制度，需要付出的经济成本、时间成本，都比较高昂，也是降低生育意愿的一个因素。,87
赡养老人 是中华传统 但是吧 母慈子孝 首先得母慈 年轻的时候怎么想不到老了 晚景凄凉 我奶奶对所有人都特别好 所以即便爸妈离婚 我妈对奶奶也很好 没说老人家半个不字,83
傻女人才会给一个不珍惜你的人去打胎，有了第一次还不醒目敢，连续还打了6次，以我的性格敢叫我去打胎，估计他这辈子也不可能再有生育能力,65
啥时候能造一个小说里写的生育舱出来,17
啥时代了还在这赛博贞c锁呢，捡点不检点的，现在很多地方都是怀了孕才去领证的，生育率都跌破井底了，舆论还在这批判想要孩子的人，真是💊。这个时代未婚先孕也算是个事的话，先禁掉未婚同居和未婚行为呗？也就是所有带把的人没领证都得老实着，这现实吗兄弟？,121
伞兵编剧，人家想生就生不想生就不生，这是你该管的事情吗？,28
伞兵？老娘又不喜欢男的，给我推这种视频，为了生育率也是够拼的，拉黑了,34
三条生病概率（比如脑血栓 静脉血栓）已经明显高于普通人了，四条想生下来就够呛，我们高中生物老师说过，人类基数还是比较大的，但是基本看不到看见染色体非常异常，甚至因此长得奇形怪状的人的原因，就是宝妈在怀孕早期直接流产了。,109
三胎走起，避孕一边去,10
三胎政策推行者,7
三胎政策从娃娃抓起,9
三胎预定哈哈,6
三胎配套措施？？？还有底线么？？就不让你割韭菜，就不让你洗脑，气死你个王八犊子,39
三胎就算了。从没有考虑过二胎。,15
三胎都放开了，就下来就是456胎，避孕已成过去时,24
三胎不在五险之中，超脱三贷之外，是为仙。好家伙6个,25
三胎 是 说给 富人的,11
三十岁半个月一次？？怕不是要准备离婚了哦,20
三年了，一直没得二胎,10
软饭硬吃嘛，很多男人都这样，觉得结婚怀孕了就套牢了，特别是现在有了离婚冷静期后,39
如果作为女性的生育权一旦被剥夺，那女性就会被彻底沦为生育工具，往最深层次探究，如果说一个男人只要想有一个属于自己血脉的孩子，他可以用暴力非法的手段使女性怀孕，并生下孩子，那女性的人生自由将会岌岌可危，这会滋生多少犯罪，人性的可怕难道大家都不清楚吗？,124
如果真的有做好准备打算生育的姐妹，怀孕之前一定要健身，怀孕对身体影响真的不是盖的。肚子被快速撑大以后，妊娠纹算轻了，还有可能出现漏n、脱垂等问题，但如果你孕前跟着手机应用G动锻炼盆底肌，就能避免这种情况，还可以帮助加快顺产，而且产后恢复也快。,121
如果真的心疼老婆的话是不忍心让她生小孩的吧 除非她真的很喜欢小孩自己想生下来,38
如果这个女的想坑你，你就是被确诊无生育能力她也会告诉你会怀孕的。,32
如果丈夫连陪产都做不到，正视生育过程都做不到，又有什么权力拥有这个孩子？血淋淋的伤口看了会有心理阴影，那么经历过此事的妈妈呢？她们就理所应该接受吗？,74
如果有药物能一辈子没有月经，除了对生育以外没有其他副作用，那岂不是很幸福,36
如果有舍不得孩子的，其实想生也有办法，嗐。根据法律，不结婚婚前协议无效，未婚生子彩礼可以不退，孩子户口可以上女方，之后还可以要抚养费。,67
如果有人想有婚前性行为，那么就要承担和婚后一样的法律责任，哪怕只睡一次，分手了就像离婚一样承担法律责任，这样，就不会有人再有婚前性行为了，也不会有因为婚前有性行为而不想结婚导致的堕胎了。,93
如果因为这个男方跟她离婚。女方可不可以起诉要求因男方恶意以不存在的理由与自己离婚，而要求多分一些财产。毕竟这么一个家庭却是很委屈女方了,67
如果一位妇女不能自由控制胎儿，那只会变成生育工具，一但怀孕如果所有权都在丈夫或者别人手里，要是遇到坏人，那么你就必须生下来，这和强迫有什么区别？,72
如果一方不孕或不育，且是丁克，那是不是挺好的，不用带安全措施了就,32
如果一方不想要孩子，但伴侣不配合避孕，这种情况下还要过性生活不就是强奸吗？如果一直偷偷摸摸避孕，始终没怀孕，你的伴侣要你一起去医院查生育能力呢？这不也是一种欺骗吗？有矛盾不应该早点讲开，不要浪费双方时间吗？,103
如果要生孩子，我觉得一定得是自己想生，为了自己生，而不是说因为其他什么,35
如果想要小孩子的话，别耽误了，过几年在离婚在找对象想要孩子的话都40了，不想要孩子的话就无所谓了等等看,51
如果想不离婚 房子直接过户到我名下 公证赠与 就不离婚。年薪四十万十年才400万 自己15w年薪 太拎不清了,54
如果想把生育权掌握在自己手中，请主动坚持吃短效避孕药。安全套主要是为了避免传染病，况且薄款的也容易破裂，这极为影响人的心情。当然我没有说不戴套更好，如果是固定的伴侣（比如婚后），其实按时服用短效就够了，实在不信任对方，那就吃药加上套套。,118
如果我四十岁我会毫不犹豫的离婚去找你，如果我三十岁我会分手了去找你，如果我二十岁我会奋不顾身去追你，可我现在只有六岁，一年级的拼音让我焦头烂额，原谅我这一次辜负了你！,83
如果我是这个女的，出院后就离婚，哪怕自己一个人生活也好，这样的婆家丈夫根本一点不值得留恋，他们不会心疼你的,53
如果我是那个患者 我就会开诚布公的和丈夫说，我不想孩子，经过沟通无果后。。那就不是我的问题了 当然我本身虽然不是不婚主义者，但绝对是丁克一族。。所以存在这个问题。。。我会在结婚前就和丈夫说清楚 不生小孩,101
如果我是怀孕的女的！我离婚！这种婆婆还是算了吧,23
如果我没记错 生活大爆炸的伯尼好像是怀孕了 然后搞了个二胎剧情出来,33
如果我怀孕我一定不敢堕胎…因为我就是在计划生育时代的二胎…如果我父母去堕胎我早就没了,42
如果外界对于宫外孕没有那么多歧视，她可能也不会向丈夫隐瞒这件事情…,33
如果通过，建议该法案反对者直接报名医疗旅游，出去手术摘除保命。有意向的可以提前准备，然后在有生育能力后立即受孕生育，再行摘除,62
如果是我可能都懒得去医院检查身体不能生育结婚也省了，正合我意,30
如果是我，我不会选择堕胎，但我坚决支持女性堕胎的权利。这仅仅是我个人的选择，生育是我人生规划的一部分。我有支持我的父母和足以养活我和孩子的能力，所以我选择生下来。如果我不具备这样的条件，我也希望我有做其他选择的机会,107
如果是我，我不会离婚，我会等这个女的，因为时间站在我这一边,29
如果是刨腹产！这么快二胎，谁敢留她？,18
如果是女的婚前感染，看男的应该是婚前不知道，如果婚前就知道肯定不会结婚的，所以婚前女方有艾滋病且没有通知男方，婚姻自动无效；如果是婚后女方患病，要么是出轨要么是吸毒，应该属于过错方，赔点钱也能离婚,98
如果女性不能左右自己的生育权，就会沦为代孕的工具。,25
如果女的是不婚选择怀孕，那么另说。如果孩子爸爸是存在的，那么两人作为孩子父母，怎么就不想好先领个证呢？9块钱。要么孩子爸妈就是有这个经济实力，别想着这单位的补贴了，以后孩子教育奶粉什么钱都能够负担，那你们是不是未婚先孕，谁管得着呢是吧？反正你们也不伸手找社会要钱。,132
如果你真的喜欢抽烟，请不要哭天抢地的说烟的危害有多大，如果你真的喜欢家暴男，请不要镜头前声泪俱下的要离婚，这并不是受害者有罪论,63
如果你想拥有激情的性爱，那么就在上床前喝一杯咖啡吧；如果你想毁了自己的性生活，方法同样简单，那就是再多喝上一两杯。据美国著名性医学专家指出，咖啡对性爱有一定影响，适量有益，过量则有害。 专家介绍说，咖啡影响性爱，是因为它会对交感神经和副交感神经产生直接影响。交感神经与副交感神经对人脑的控制互为消长：白天在外界环境的刺激下，交感神经占优势，让人兴奋；晚上睡觉时，副交感神经占优势，让人放松。 如果性爱前喝了超过两杯的咖啡，交感神经过度兴奋，人就无法产生松弛、愉悦的心态，性爱的美好情绪会被焦急代替，性欲会降低，性生活质量也就会大打折扣。在性生活后饮用咖啡超过两杯，还会使人体仍处于兴奋状态，不利于身体恢复。 不过，对于交感神经不容易兴奋，或者因为身体疲倦而无性欲的人来说，性爱前喝一杯咖啡，可以把自己的情绪调动起来，提高人体对外界刺激的敏感度，对性生活产生的快感印象特别深刻。还有研究表示，性爱前喝一杯咖啡，能让性高潮提前出现，并且对女性的作用比对男性的作用更为明显。,434
如果怀了孕后面流产的夫妻双方都应该去查一查，到时候该治病治病，该离婚离婚，一起接受了的就不要提。,48
如果孩子生下来就是畸形的话，那么他将会面临社会舆论的挑战，他也许会受到友好对待，也有可能会受到歧视虐待，这个谁也说不准，也不好说，但是这些孩子他如果没有得到正确的引导的话，就会有自卑感，对他而言，是不公平的,103
如果感情能被陪产所看到的场面而影响，赶紧离婚赶紧跑，这得心理脆弱成啥样啊？ 而且这些离婚的案例怎么就能直接归咎到“因为看到女性的生产场面了”，离谱，太离谱了,78
如果夫妻感情很好，又已经有孩子了而且不打算再要，我也觉得男性结扎比较好。但是那些喊着丁克平时又容易改主意的，又或者感情一般的，还是不要结比较好,71
如果从一切的源头开始纠结，那咱们来反一反任何不以生育为目的的性行为吧,34
如果不允许堕胎我甚至能想象家长能对一个年幼的孩子说出多么残忍的话 例如↓ “你以为我想生你吗？我早就想杀死你了，你怎么不自己去死啊” 父母对于这个孩子的怨气从一开始就在积攒 更何况很多女性的怀孕都是非自愿的 甚至年纪较小的女性身体都没完全发育就要生孩子，说不定母子都活不下来,137
如果不是真的爱对方，那个女孩子会愿意忍受这么多给男方生孩子呢？希望更多的男性能意识到这点好好对待那个愿意给你生孩子的女生。女孩子也要明白你不想生没有人有资格有权力逼你生，在没有备孕打算下还不做安全措施的，拿各种理由让你生孩子的，让你辞职生孩子的绝对都不是值得你去爱的人,134
如果不是很爱自己的老婆或对象的话，男人是不会去结扎的。 在男权社会，失去生育能力本身就是一种耻辱。 还会私底下被同事叫成太监。,63
如果不婚不育被列入违法行为，我希望我能被判处无期徒刑,26
如果不打算让贝拉生育还是要做绝育，要不以后子宫蓄脓也很痛苦,29
如果本来不想生被强迫着生下来的孩子，以后也不会有良好的教育。那岂不是大大增加了社会隐患吗？,45
如果安最后没说这些话 是不是可能就不会死 只是离婚或者送去修道院 亨八说等她休养好了再谈 她好了后亨八也没说什么 估计就是筹划着离婚 正是因为安说这些话刺激到亨八了 而且加上查尔斯的告密 这下给亨利找到好机会 再加上想和西班牙结盟 安非死不可了,122
如果12岁就有生育能力，假设一半都是双胞胎，生到六十岁,27
如果，我没什么问题，但是主动要求，强烈要求，切除子宫，医生能同意吗，或者退一步直接切除输卵管，不想结扎，结扎还有复通的可能性，想一步到位彻底失去生育能力（什么试管婴儿就不用说了，人家没那个钱带我去做试管）,102
日常恐婚恐育 最好的办法就是，你不婚，我不嫁，养老院里蹦恰恰。,31
日本为了提高生育率搞这一套,13
日本会不会是不婚食草宅拉高了数据,16
妊娠纹是孕妇损伤里最不值一提的……感谢我妈，生育慎重。,27
妊娠纹是属于生育损伤吧？看到伤口正常人不会产生心悸，疼痛一类的情绪吗？,35
妊娠纹是生育过后的痕迹，更代表着有生育能力的权力，让没有生育能力的人评价生育痕迹本就非常多余,46
妊娠纹是生育代价，伴随着身材走样……那样的纹路确实恐怖，我也无法接受自己光洁的皮肤变成那样，所以我选择不生,53
妊娠纹跟遗传有关系，想生孩子又怕长纹的，除了要控制好体重，还可以去问问妈妈和外婆，我妈姐妹三个，除了二姨以外都是二胎，外婆生了四胎，都没有长纹……她们的肚子也没有跟视频里这样，反正我妈和我小姨生完二胎身材几乎没变化… 我怀孕的时候是39周长的，一点点，而且我肚子上没有黑色的妊娠线，生完以后肚子跟怀孕之前也一样，这种孩子一岁多了，纹基本上退的看不见了，不过还能摸到 不想生的就不生，想生的可以问问自己妈妈,202
任何避孕措施都不能保证百分之百避孕成功，有时候堕胎实在是没有更好选择的下策。一味禁止堕胎等同于从另一个角度剥夺了女性生育的权力。如果没有能力抚养意外怀孕带来的孩子就一定要做好避孕措施，如果避孕失败也应尽快服用紧急避孕药，如果还是怀孕了就尽早去正规医院做手术，不要等着胎儿成形了再去引产。,143
任何避孕措施都不能保证百分百的成功率，所以，这女的是想讹一笔钱做手术，药店也有问题，一般药都有医药公司的正规发票跟物流货单，直接拿出来，让她告，都离婚了还不自爱。脑子有病。,86
认为自己没有生育能力，就可以随便造谣了嘛，他甚至没有调查行动，张口就来,35
人造子宫+不婚不育，期待那一天的到来！,19
人体研究学，上面都有，三十二到三十五岁时生育能力最强，生出来的孩子也是最优质的，可是现在大多数，作息不规律，饮食不健康，纵欲过度，现在基本上所有人都有睾丸疲劳，子宫萎缩，中医称之为肾虚和气血不足,97
人太多了，如果生育率低，就该上规定了,18
人是懂折中的，当你说避孕药不好，他们会举一万个例子不良反应可以一段时间缓解，变胖是因为个人生活习惯，血栓？什么血栓风险你可就是男女对立了哦，但是当你说结扎好的时候，没准他们就同意戴套了 结扎绝大多数不良反应也是一段时间后可自行缓解的，对于没有生育打算的男性来说可太好了！而且还能避免随地乱留种被捞女恶意讨要抚养费呢 而且美国30-45岁男性结扎概率还是大于10%的哦 按照一些人说法，欧美人均受教育水平高，你们抵触结扎就是未开化 （最后 泛生活理由没必要吃药做手术 身体是自己的qwq,242
人生有选择，可以选择不生，自己选择的苦难不是要挟别人的理由。至少接受过九年义务教育，强迫发生关系是强奸，中国堕胎不违法。借题发挥搞两性对立就是纯脑残，早婚早育，晚婚晚育，不婚不育都是自己的事，跟别人没关系，评论写出来有啥用？谁还能给你个嘉奖？,121
人人都有生育权，不要嘲弄人的苦难。。,18
人嘛，开心最重要，想生就生，不想生就不生，不冲突,24
人流要刮宫，把刚形成的胎盘和胎儿残肢给刮干净，很伤宫壁，每刮一次就薄一层，到后面无法自主形成胎盘，就没法生育了,55
人流七次，还准备生二胎，这是女超人呐,18
人流和生育都是伤害极大的，大家一定要对自己的身体负责，你的身体是你自己的，别人说啥都不管用,45
人类的繁衍本就受自然调控，计划生育的回旋镖终于还是来了，独生子女下的产业生态肯定是不一样的，人是经济文化的载体，人为控制只会成为诸乱之始。,69
人类并不是孤雌繁育，婴儿的诞生来源于男女双方，因此女性如果有生育权、堕胎权，那么男性也理应享有生育要求权和堕胎要求权。 如果女性不尊重男性的要求，拒绝生育或者未经男性同意私自堕胎，应当向男性支付相应的赔偿金；如果女性未经男性同意私自生育或未按男性要求堕胎，那么男性不应该承担相应的抚养义务。这才是真正的男女平权。 如果无视男性在生育方面的合法权益，那我支持取消女性在生育方面的一切权利。,193
人间冷暖太真实了，传统婚姻传统观念在中国还是根深蒂固，在传统的婚姻里带给女性的伤害真的太大了，也看过很多案例，确实也不见得养儿就能防老，所以现在很多年轻人宁愿违背传统父母辈的观念，也要选择不婚不育当丁克，总之我觉得每个人都有选择自己生活的权利！,122
人家自己想打掉就骂人家，这也是道德绑架吧。没有做好这个准备，不想生孩子，关你们屁事啊,42
人家想生就生，别指指点点，开口就说以后怎样怎样，跟诅咒别人似的,31
人家是演员兼模特愿意嫁给你就偷着笑吧，你还这事那事，赶快离婚吧，你配不上这种小仙女,41
人家生育率低加宗教肯定要这样做,15
人家女的不想生不行啊，一直刷男的绿了是啥心态啊,23
人家就是想离婚罢了，只是想找个理由而已，医院没搞错就不离了？,30
人家都说了，不考虑生育可以选择结扎，又不说逮住你就阉了，而且结扎个人选择，又不是说是男的都得结扎，就这某些人破防了？相对于女性结扎，男性手术伤害更低。就这不行了？就这破防了？女性结扎，行！男性结扎，不行！懂得都懂。而且人家科普的是女性byt的视频，随口提了一下，就炸了。,135
人家单身妈妈想生就生，想不要就不要，关你们屁事？说是为爷爷奶奶着想，为什么不为女方着想？说是为肚子里的孩子着想，你怎么知道人家孩子想这么活着？别站着说话不腰疼，有空说这种话还不如回去管管自己家里的破事,100
人家把最帅的年华给你了，现在你想和人家离婚？,22
人工流产=放弃生育权！看看多残忍 直接给孩子分尸了！你还配又下次吗？ 就算别人允许 上帝都不允许！,49
人多了科技发展就快，就业机会就多？单多了老板不会减单价吗？,29
