cleaned_text,text_length
就是故意的呗～主张生育的大环境说这些……,20
第三胎，不来月经，不会想想是不是再怀孕了？,21
对啊 人家是不想生啊,10
既然不想生，能否不交配？,12
为什么三个月都不去复查，这个女的是自己想生吗？,23
这个律师完全是把事实往夫妻自己选择保留胎儿生育下来上推吗,28
突然想到一句话 越是基因遗传价值越小的人越想要生育……,27
还想生呢,4
不婚不育,4
还想生啊？,5
你这还想生娃啊,7
还想着生育,5
既然想生育为什么那么不自爱啊 到底咋想的,20
就这样以后还想生育啊,10
她对自己都不负责，还想生孩子,14
还想生育别想了,7
？？？流了3次，还想着生育，做个人好嘛，不敢想象她的子女会有,30
这还要生育…,6
你居然还想生,6
SOS。前几次人流怎么就没想着要考虑生育功能呢,23
挺好的，以后别生育祸害孩子,13
三次人流了还担心生育？,11
打了三次，以后还想生育呢？薄成饺子皮了,19
你居然还想生育！早tm干嘛去了,15
流了三次盆腔还烂了，你说对生育有没有影响,20
啊？这还想生育？,8
还想着生育……早干嘛去了,12
你还知道想生啊，拉倒吧,11
还想生育,4
还想生？,4
还想有生育？我笑了,9
我整个一个大迷惑！你都人流三次了，术后还不遵医嘱，你还想生育,30
打了三次胎还想着影响以后生育,14
这还想生孩子那，我的老天你可别嚯嚯孩子了,20
一个人流三次的人，还会在乎生育吗？,17
都这样了还想着对生育有没有影响 她自己不知道？,23
都人流3次了，现在问“影响生育吗？”，也是个人才,24
三次人流才关心生育问题,11
如果你还想生育的话,9
tm笑死人流都做了那么多次 还会担心生育问题？,23
这样以后还能生育吗,9
笑死。你还想生啊。。,10
无语。。这么在意生育问题早干吗去了，自己都不知道爱惜自己身体,30
你还生育？？？？？？怎么配的,14
这么多次人流你还想生育？？,13
你还想生孩子，无语了。。。。对自己都不负责还想怎么对孩子负责,30
生育打算,4
你还想生孩子？,7
想生育还这么糟蹋自己,10
这时候担心生育了，早干嘛去了,14
你说呢。。。还想生,9
卧槽，还生育呢,7
估计再也无法生育了,9
这人早晚无法生育,8
这种伞兵女人就得让她失去生育能力才知道长记性,22
不想做手术，怕影响生育？,12
女生的原生家庭有大问题，她连做人的基本尊严都没有,24
没怀孕再离婚？,7
我记得日本有个法律，女性离婚后6个月才能再婚,22
想离婚为什么不能一起睡，起码对方是合法的而且省事还比外面的干,30
我还见过离婚两年的还偶尔一起睡觉的，我身边的人,23
都在闹离婚了还同房不太理解,13
要离婚还一起睡的也是无语，证明不是很想离,20
离婚还敢碰？切了他…,10
离婚冷静期的作用？？？？,12
离婚冷静期原来是这个作用啊,13
哦no我有个同学就是爸妈离婚了发现怀上了。。。,23
可以走生育险啊，相当于不要钱,14
来了月经在离婚,7
不是女孩，是生育了一胎的妇女,14
笑了，以妈妈那个b德行换谁都不想生一个自己的影子,24
人流真的不能随便做，可能会导致无法生育,19
ctmd，怎么还跟原生家庭有联系啊！！！,20
她自己害怕见到孩子害怕见到那个自己，不能生育对她自己来说也许,30
人家都不要孩子了还在乎能不能生育？,17
为什么不要孩子，啊，是原生家庭带给她不知道怎么做母亲吧,27
哪里来的弟弟？不是生育不了了吗？,16
原生家庭的痛苦让她觉得自卑，不配为人母,19
这样的原生家庭让女主怎么清醒啊……,17
好不容易逃出原生家庭了 为什么还要联系,19
弹幕刷贵州人的几岁?地域歧视?这样和她一样有素质,24
生育伤害更大,6
生育伤害大？别nt了,10
有病啊一直刷男的被绿了，你以为生孩子容易啊？不想生不行啊,28
你们有毒，人家不想这么快二胎一天到晚刷绿，一点素质都没有,28
怎么不说女的不想生男的逼着生呢？站着说话不腰疼,23
生育权是女人自己独有的权利，可以自己决定去流产,23
男的想生自己生,7
哥们，别纠结钱了，先考虑离婚问题？,17
一胎是抱着试一试的心态怀上的，二胎是意外来的，现在已经快生了,30
简单 先离婚 再谈一次恋爱 然后意外怀孕,20
意外怀孕影响生育能力了呗,12
我也是多囊！！！！呜呜呜我还好怕自己难生育,21
有第二胎了,5
二胎时代来了,6
二胎都有了,5
二胎二胎,4
二胎来的,4
二胎来的,4
二胎都有啦,5
二胎时期,4
二胎都来了,5
二胎都有了,5
二胎时代来的,6
二胎来的太快就像龙卷风,11
二胎来的太快就像龙卷风,11
都是二胎了现在,7
恭喜有二胎了,6
你们已经有二胎啦！！,10
二胎了,3
二胎裂开了吗,6
二胎时代回来重刷,8
二胎考古,4
丁克路过,4
本来不想生娃，看到你们犹豫了,14
如果有二胎是不是叫以以,11
其实也有很多年轻人不想生孩子的原因是自己明白没有办法养好这个,30
不会影响就业和工作吗,10
这个没什么好说的吧就是不想生啊,15
但是我觉得生不生孩子是个人字由，你们想生的也不能说让人家就也,30
本人985毕业，就业压力大，养自己都费劲呢现在,23
不不不，网上讨论只是想生育自由，生与不生由自己，并非是劝不生,30
网络上只是说生育自由吧 如果确实不那么喜欢孩子或者没有能力抚,30
丁克以为他们想开了,9
那不婚前性就不正常了，我负责任，100%避孕,22
红字不婚前还挺骄傲的，祝您婚后性生活和谐咯,21
因为当年计划生育弄的,10
我是怕养不好所以想丁克,11
我真不想生,5
哎 我妈现在听说我朋友离婚第一句都问有没有小孩,23
就是不想生 和你们想生也没区别,15
我不想生单纯因为麻烦 没那个奉献精神把它照顾好,23
简直就是我和男朋友的理想生活,14
怎么办啊 不想生小孩,10
丁克沉默,4
然后现在已经有二胎了,10
同二胎来的,5
看到怀二胎点进来的,9
但是你立马就怀上二胎了,11
但是迅速二胎？哈哈哈哈,11
有二胎了,4
现在二胎都有了,7
二胎后来考古,6
想生就生，不想就不想，这是女性的权利，生育风险很大的,26
你都有二胎了，假的吧,10
有的讨论生育自由，但有是在劝不要生，看了真的很烦,24
我这个收入，我生孩子，真的会降低生活质量,20
我在白庙也许愿了，当时刚毕业就业压力非常大就很抑郁许愿想要接,30
才大三就想生孩子了？,10
然后二胎就来了,7
二胎回顾,4
秒啊，刚刚从二胎视频过来，果然两个公狗怀孕,21
可是不想生娃的话应该做好措施，我觉得生孩子这事不存在意外,28
所以还梦到二胎了,8
男的还要生育权啊…,9
男的可以有生育权，自己怀就能有,15
因为男的不需要承担生育风险，就没有权力让女的生,23
生育权在你手上啊，还谈啥，他有资格谈吗,19
你都不能生，你要什么生育权,13
男的就是没有生育权,9
男的又没有生育风险，还管挺多的,15
也不能这么说，如果你能怀你也有生育权,18
生育权是女性自己的权利，27了清醒一点，不要乱生孩子,26
提离婚是本来就有的权利啊，女的也能提，等于没有权利,25
男的有生育权但没有堕胎权,12
但如果结婚了，男的以生育权为理由要求离婚，法院会判离，我看过,30
说体外能的，建议去医院检查一下生育功能是否正常,23
什么丁克,4
呀，药广告这么内卷了吗？,12
不算渣男吧，他也听到小美说不想生孩子,18
打掉是因为女孩不想生好吧，不是男的想打，小男孩挺好的,26
三胎,2
当时那个年代生太多就会罚款，我家会有二胎的，我爸妈为了防止罚,30
封建迷信害人 这些人想生他们倒是自己生啊！,21
这不丧失生育能力,8
生三胎！！！（doge）,12
50岁高龄产妇，确实不容易,13
真心希望出个重大遗传病的不能生育,16
这，，，生下来以后孩子遗传病肯定一大堆，然后还有外界还歧视，,30
我告诉你真相 生育对女人的伤害比堕胎要大得多,22
我想生个奥特曼,7
食死徒下岗再就业,8
食死徒下岗再就业可逗死我了！,14
45就高龄啦，哈哈,9
前面的，那你觉得什么算高龄？八十了再生个孩子?,23
45做为产妇真的算是高龄啦,13
无语，45岁生孩子不算高龄？啊对对对 少女行了吧,24
35就开始算高龄产妇了,11
35不算。高龄产妇。高龄产妇在乎于之前生没生过孩子。,26
35以上都是高龄产妇，没常识就知道哈哈,19
35算高龄是因为唐氏风险开始增大，不是生娃困难,23
我妈32生的我 当时护士都说她是高龄产妇,20
我30岁生娃，被老家的阿姨说是高龄产妇。她闺女大学毕业生的二,30
对于产妇而言过了35就算高龄,14
35就算高龄了,7
当然，45岁早就是高龄产妇了,14
是没jj吗？就生育残缺了，哈哈哈哈哈哈哈哈,21
天啊，这孩子以后怎么和别的小孩竞争,17
从那个男人说自己没有生育能力的时候我就知道，他只是养不起而已,30
多的是这种男的 离婚的那些你看看吧,17
以前夫妻之间都这样，天天闹矛盾离婚，日子还不是过得好好的,28
不错了这么久都没离婚,10
男的以为自己没有生育能力,12
毕竟医院判定他没有生育能力,13
支持我的社保就靠他60后的三胎了,16
这是妇女生育权利，必须支持,13
当然支持，生育权啊，但得自己养哦！,17
其实也是弥补了中国最高龄产妇的空白，医学作用功不可没,26
就想问一下，如果孩子几岁的时候这对父母高龄瘫了怎么办,26
希望爸妈生三胎,7
我刚好是丁克，这要我父母老年产子，我会高兴的,22
主要是高龄产妇危险好大,11
吐槽印度的，忘了几年前老人夫妇生育遭到的网络一片骂声么,27
？？？二胎开放，我同学一堆有弟弟妹妹,18
考虑个p，二胎都养不起,11
高龄产妇挺遭罪的,8
三胎吗？算了。,7
为啥要加后面这句?劝人生三胎？！马上不想点赞了,23
所以别人想离婚呀 为什么结婚就一定要生孩子,21
三十多没要小孩，往后生育风险会大很多,18
……离婚谈恋爱，太秀了,11
你想要丁克婚姻那你为什么不事先说好，不负责任啊,23
一起八年没生 离婚就意外怀孕的好女人是吧？,21
结婚八年不生 离婚了就能跟小十岁的生我是理解不了说实话,27
作妖，后面玩一玩不婚生子就快乐了,16
离婚了两清了，你去冒险没人阻碍呀,16
清醒认识性格不合而早早离婚，重新选择，真是太棒了！,25
不想生孩子的根源恐怕是不想和前夫生,17
我非常能理解这个女生离婚的决定。虽然相恋8年，但是恋爱关系是,30
三十四岁已经是高龄了,10
34正常婚姻不想生，结果姐弟恋单亲生？,19
非常难以理解，和前夫因为不生而离婚，和小男友生下孩子对方不要,30
如果遇到这样的男的我也会选择离婚的,17
没有小孩离婚真的没啥，一有小孩就不一样了,20
那么多年才明白？不该早早别结婚或早早离婚吗,21
不想生早点说就行,8
我老公也是这样，但是我不能离婚,15
想不想生都没错，婚前表态。不要耽误你前夫,20
你跟前夫不是婚后才因生育观念离的吗,17
应该是有原因才离婚。婚前关心，婚后现原形很多。,23
觉得你离婚是对的选择，也不要结婚了，就一直恋爱,23
不婚不育,4
不能面对又如何？还可以离婚啊，哈哈,17
跟你前夫婚后这些年都注意避孕措施 离婚后和男友就不注意了？,29
那种歧视女生的，贬低女生年龄的最好不要被女的晓得了，晓得了就,30
离婚的原因是不合适啊，生孩子是意外怀孕后的决定啊，这有什么可,30
离异有娃，和弟弟恋爱，是我的理想生活了,19
谈吐还可以，但是客观来说，没什么竞争力,19
为什么要有竞争力呢，你自己过的怎样,17
那你当初为什么离婚,9
说明压根不是生小孩的问题导致离婚,16
主要女性的适孕期比男性短太多先天弱势 如果七十岁还能生育那我,30
以前离过，离婚带娃,9
30岁不想要小孩而离婚，现在单身又想要小孩了，这不是前后矛盾,30
不歧视，接受自己的选择就好,13
我的理想生活,6
现在是在清朝吗？我就不想结婚但想生娃,18
离婚和带娃是两件事,9
你们听懂了吗？她不是不想生娃，是和前夫在一起不开心,25
没有哦 离婚很正常。离婚带婚生娃也很正常。小三带娃也很正常。,30
离婚私生带娃,6
前夫就是不配啊不然离婚可以复婚,15
不，你是离婚带的不是前夫的娃，你对孩子公平吗没有爸爸,26
奇葩，因为不想生孩子离婚，离婚后私生活混乱，生了个孩子,27
因为不要孩子离婚，离婚后生孩子，请问你有没有孩子怎么想,27
离婚带娃？你在侮辱前夫,11
前夫？还是不爱了吧，34岁不想生离婚，36岁和26岁的生,28
不是歧视，是人之常情,10
现在离婚率那么高，有钱女自己生好，以后孩子只用对她负责，压力,30
对，就是前夫不配，想生就生不想生就不生,19
34还不想生娃 36就又觉得需要生娃,18
男的坐不住啦跳起来啦生育权在女人手里生不生女人决定不需要理由,30
你这离婚带娃和别人离婚带娃本质上的不一样,20
就是后悔离婚了,7
没离婚也并不会,7
说实话跟初恋这么多年 不生孩子 离婚了随便浪然后跟别人生 有,30
36岁也是单身没娃也未婚啊，咋的了年龄歧视 36女的不能谈恋,30
33岁不想生孩子离婚了，36岁跟其中一个小男生生了孩子，真秀,30
人家说其中的一个 意思是离婚后谈过一些男朋友 又不是说同时交,30
如果我说你俩即使结婚也会很快离婚，你信吗？,21
你们好奇怪，人家有自主决定什么时候生育，什么时候过什么样的生,30
不不不 您这可不是离婚带娃 是离婚后 乱搞出来的娃 可,27
前夫让你生，你觉得不想被困住，离婚两年意外怀孕就要了？？这我,30
34岁离婚，36岁怀孕，而且还是其中一个男朋友这说明她不止谈,30
想生孩子为什么不找个能结婚的人生呢？,18
你是离婚带娃吗，你是乱搞出来的娃,16
不是，女生的意思是离婚后谈过几个年纪小的，但不是同时啊，没想,30
强迫了?笑死这次她想生?在外面乱搞被中枪了，哈哈哈哈真牛,28
觉得和前夫三观不合，再加上年轻，不想生孩子很正常，年龄大了想,30
姐姐做得棒！就是自己想生再生。,15
两年多不让人心理发生变化是吧？而且人家正经离婚了谈恋爱，怀生,30
34岁不生孩子离婚，两年后非婚生孩子也要生,21
前夫的失败之处就是还商量着要孩子，要么也不能离婚,24
人家离婚了单身，谈恋爱怎么了,14
离婚是因为前夫这个人在否定她，不是因为不想跟前夫生小孩，你们,30
离婚了关前夫啥事呢？,10
前夫哥:听我说谢谢你，还好离婚了,16
对就是歧视。 自己作成这样的局面的,17
你是滥交女，根本不是普通的离婚带娃的,18
不要侮辱其他离婚的女性,11
弹幕都是裹小脑的 男的离婚可以再找女的就不行了？,24
py一堆哈哈还好你离婚了,12
34岁在婚姻中不想生，36岁突然想生了？,20
不是自己喜欢的就不想生呗,12
但是到时候离婚很麻烦，还不如这样自己生,19
不是离婚带娃的问题，感觉思想不成熟，做事又不思后果，令人后怕,30
生过孩子才感觉到那些选择一个人生育的女性有多坚强,24
你前老公想要你不要，你离婚，后面找的弟弟玩，弟弟不要，你想要,30
之前节目算命就说过她，未婚生子离婚当小三什么的,23
她离婚了,4
我妈也是当初为了我不离婚 可是我真的宁可单亲家庭,24
我小姨也是21有孩子，还叫我读大学的时候把孩子生了以后就业不,30
离婚吧,3
赌？赶紧离婚，离越远越好,12
都这样了改不了离婚，省的动不动有一堆债,19
离婚，还钱,5
不离婚等着以后更苦吧,10
还不离婚啊,5
离婚吧,3
女生快离婚吧,6
表示看面相有点歧视，，，,12
赶紧离婚,4
离婚了 小孩怎么办？,10
离婚 还钱,5
离婚！,3
死男人，离婚吧,7
赌钱真的救不了了，离婚过吧,13
快离婚吧！！,6
离婚,2
她千万别离婚 她离婚是害人,13
这个臭逼还有理了，不离婚等着过年呢？指不定下次给你迷晕了把你,30
那就离婚呗,5
k离婚啊。还劝和,8
太好了，这个男的想离婚就离啊，抓紧机会,19
报警然后起诉离婚,8
建议你离婚并把孩子丢给男方，你继续自己的大学生活，将来能遇到,30
离婚了之后已经有小孩了，没必要嫁人。现在这个社会没有男人照样,30
直接离婚，然后报警，让男的去还贷款,17
离婚吧 你的青春大好 别和这个恶棍纠缠了,20
离婚一定要离婚,7
离婚铁了,4
不要抱希望了，离婚更好，真的。我家和这情况差不多,24
都过不下去了还在一起有什么意思，这年头还在乎离不离婚吗？,28
离婚离婚,4
故意这么说，其实想离婚,11
离婚啊，哇哦抚养费啊，给不起告他啊,17
离婚啊,3
快离婚,3
离婚,2
离婚后这些债务还是男方偿还,13
青春大好，孩子放弃，离婚，人生还有很多可能,21
赶紧离婚吧,5
离婚吧,3
哭屁啊！不离婚留着骗光你家的钱么,16
这女生看来知道啊？还不离婚？,14
离婚 止损,5
woc赶紧离婚，沾黄赌毒的一点都不能要，这辈子都毁了！,27
黄赌毒三个占一个就完蛋，必须离婚,16
离婚吧,3
离婚啊 自己烂别拖累别人,12
离婚，还钱，抚养费,9
赶紧离婚,4
离婚吧，这种生活还能过下去？不要委屈自己,20
这种货色不赶紧离婚，还跟他废话什么,17
这个女的大学上的什么，这么单纯，这不离婚留着过年啊,25
痛快离婚不好吗？断舍离，改什么改,16
女孩好好呀，很善良，无论男方离不离婚，她都很有礼貌，真的好棒,30
离婚吧！赌博的人改个屁,11
赶紧离婚！,5
还钱离婚这么简单的事,10
先离婚，然后告前夫，要银行为乱贷款负责，明明这么简单,26
还有人问离婚了怎么再嫁，先逃离这个赌鬼吧！,21
这女的为啥不离婚,8
离婚吧 这不该是你所肩负的责任,15
五万块钱能彻底看清这个男的跟他离婚，我觉得这个教训值得,27
过不下去离婚。,7
离婚,2
离婚是共同债务,7
离婚后告他，债务不用你承担,13
家暴赌博，那你赶紧离婚吧,12
离婚，然后父母和他断绝关系，用不了多久他就会欠一屁股债，死外,30
赶紧离婚 抱着孩子跑吧,11
离婚塞,3
职高怎么的?瞧不起人?歧视?呵,15
职高怎么了？？这是个人问题好吧 别搞什么歧视,22
职高怎么了？高中就开始搞歧视？,15
一切偏见都是建立在事实上的，为什么就歧视职高不歧视别的呢？,29
看到歧视职校的我都笑了 职校高中都一样的好吗 歧视什,26
不是歧视，但大多数的专科确实能力比较差,19
赶紧离婚,4
离婚呗，孩子自己养,9
你现在也是自己带自己养家啊！跟离婚有啥区别,21
离婚吧,3
打你才离婚？你底线低的可怕,13
说实话 你离婚再找也找不到好的 要么自己过要么接受,25
他又不挣钱，离婚只用养女儿，不离婚还要养老公，姐妹你说哪个更,30
离婚也没关系,6
不要担心带女孩的离婚女士二婚也不难,17
姐姐 作为一个在这种家庭长大的孩子告诉你真的没关系 离婚吧,29
离婚了，就是赢家吗？早干什么去了？不为孩子的童年想一想吗？,29
离婚带拖油瓶……,8
二胎，措手不及,7
二胎,2
二胎啊，说绿的搞笑呢。,11
结婚了只要不想生就能堕,11
近亲生育吧……,7
不是啦，是因为遇上了珍惜自己的人才想生孩子,21
妈妈想生第五胎的时候就给孩子想好名字了！,20
第五胎妈妈是想生下来的,11
不，是妈妈遇到了对她真心的人会一同爱她和孩子，所以才想生下来,30
他也并不是想生孩子啊,10
我还不想生儿育女！（这个不是很确定。）,19
我才不想生个女儿！（ 另一种可能不太确定。）,22
我可不想生个女孩？（猜的,12
总感觉【妈妈】是不想生儿育女,14
我才不想生个女儿！！！,11
我还不想生儿育女（应该是）,13
我才不想生个女孩,8
我才不想生女孩？,8
我才不想生儿育女!,9
我才不想生儿育女?,9
我才不想生为女人！,9
然后去医院检查，女友真怀孕了，男友真没生育能力 就笑尿了！,29
考虑一下离婚财产分配问题吧，孩子,16
打高尔夫没生育能力，你给我来一个,16
他要说他没生育能力吧 估计是反杀,16
因为这个男的知道自己不能生育,14
当场离婚,4
徐若瑄这两天离婚了,9
徐若瑄刚离婚啊,7
说明塔菲三胎都是顺产，gachi了,17
塔菲三胎顺产可还行,9
如果主角是第二胎的话，那刚才的是第三胎吗？不是姐姐了，那主角,30
怀上二胎还不让人发现？看来第一个孩子周围人也不喜欢啊,26
所以第三胎是他吗？,9
我才不想生个女儿,8
应该说的是她不想生子女吧，因为有了所以被男朋友唾弃？,26
我不想生女孩？（翻译君听不懂）,15
我还不想生儿育女,8
我就不想生下女孩,8
是“我才不想生儿育女”,11
也有可能是“我真不想生为女人”呢,16
我很不想生下女孩！！（猜）,13
我想拿掉 不想生下（）,11
生育标兵,4
不是，应该是单胞胎，只不过第一胎第二胎依次排开,23
还不如直接离婚呢,8
可以离婚了,5
还没离婚？,5
终于离婚了,5
还是决定离婚,6
高龄？？？这是超超超高龄了吧,14
30不算高龄产妇,8
高龄产妇 30岁在古代算，现代不算,17
不是40才算高龄吗,9
七十岁应该早绝经了吧，绝经后还有生育能力？！！,23
36高龄产妇,6
失业偶像转业主持人(=・ω・=),16
给失业偶像打call！！！,13
不愧是失业偶像,7
失业偶像！！！,7
失业偶像,4
失业偶像再就业好评,9
失业偶像！！！,7
呦，失业偶像,6
地域歧视石锤（狗头保命）,12
失业偶像林吃素,7
失业偶像刘佳萤,7
小李失业预定,6
不愧是专业的失业偶像,10
失业偶像当主持人去了,10
失业偶像,4
扭曲一个失业偶像的心,10
豆豆子失业了，以后主持人就佳莹来吧,17
林家班果然歧视女人,9
硬核歧视台湾人,7
戢老师果然歧视女性,9
还是在歧视戢老师啊！,10
主持毕竟是失业偶像,9
二胎哈哈哈哈,6
二胎了233333333,12
二胎,2
二胎？,3
二胎,2
第二胎,3
失业偶像表示很赞,8
对啊 对啊 对啊，失业偶像真的可惜了。,19
绝对是犯罪，侵犯了患者的生育权,15
生就完了现在三胎,8
典型的不是自己挨刀就“身体伤害小一些”，女人别做生育机器啊,29
你快拉倒吧，老百姓，还鉴定还三胎，要不要脸了,22
都在生第三胎了你居然说不知道骗谁呀,17
《三胎的目的》,7
祝她不能生育,6
她自己都要别人照顾吧？还想生孩子,16
她想生就生呗，自愿的为什么骂她，后果自负罢了,22
离婚吧，还没生就这样惨,11
估计引产完就离婚了,9
离婚吧 一家子魔鬼,9
哦 这个人渣 后续好像是离婚了,15
婆婆：孩子先打掉，然后离婚找个健康媳妇,19
离婚,2
快他妈离婚叭,6
就目前中国人水平，适合生育人家其实很少。,20
离婚吧,3
离婚离婚,4
离婚吧,3
李双双最好的选择是离婚,11
离婚吧,3
我是李双双就离婚,8
李双双以后会是被离婚的命运,13
会离婚阿,4
估计回去就离婚吧,8
离婚吧，这男人和公婆看面相就不是什么好东西,21
离婚！自力更生哪男人找不到，非要跟这个人渣过下半世？,26
但凡她有个两万彩礼，都可以把孩子救了离婚,20
估计李双双的老公以后还会跟她离婚，好气,19
赶紧离婚吧 他们会祸害你一辈子的,16
赶紧离婚吧,5
离婚吧,3
李双双恢复后最该做的是去离婚,14
这种家庭赶紧离婚吧，自私的一家人,16
离婚吧,3
如果女方有彩礼就自己拿钱救孩子，救完离婚,20
请好好离婚,5
离婚吧,3
离婚啦,3
离婚,2
这一家子，不离婚留着干啥,12
只想知道李双双后来有没有离婚,14
离婚吧，这样的男方家里，不要也罢,16
出月子跟他离婚,7
离婚吧,3
感觉后续会跟李双双离婚，另外娶一个,17
那男的八成会和李双双离婚。,13
离婚吧,3
之后极可能离婚，毕竟人家要健康的孩子,18
感觉男方离婚的意愿更高。我就想骂人,17
离婚吧,3
接下来 李双双的老公会和她离婚吧！,17
生完赶快离婚吧,7
这样的家庭不要呆了，赶快离婚吧，球球了,19
离婚吧,3
我就是安全没做好喜提二胎,12
想生的都生不了,7
这药会直接丧失生育能力,11
水银会丧失生育能力。,10
这是什么为了提高生育率放出的危言耸听吗,19
我的人生主打的就是一个不婚不育不沾男,18
可是有人就是想生娃啊,10
