cleaned_text,text_length
不婚检，然后一两次胎停了还不注意，五次流产才来查，这女的也是,30
这要是我，离婚了也得把检查结果贴满他们村,20
这真的。60多岁了。分居吧。离不离婚都没啥关系了吧,25
那还不赶紧离婚，怕啥，孩子又有出息,17
不离婚干嘛啊！！,8
我也准备和凤凰男离婚,10
这不离婚等于窝藏犯人吧,11
这还是离不离婚的问题吗，这不犯法了吗,18
离婚！！！！！,7
这个大姐不离婚等啥呢,10
面临的问题不是离婚的问题，是报警的问题,19
这个嗯，太丧心病狂了，女的还能不离婚？！,20
让他老而无人养啊不离婚还人他颐养天年,18
再不离婚说句难听的 死了还要和他葬一起,19
？你不该离婚吗？,8
离谱，这还不离婚啊,9
你不该离婚吗？,7
我妈不愿意离婚,7
离婚干嘛呀！报警吧！,10
告诉对方父母，报警，离婚，分割财产,17
你不仅该离婚 你还该报警,12
这必须离婚出轨只有零次和无数次,15
不仅可以离婚还可以起诉他！,13
离婚顺便报警吧,7
不但离婚还得报警,8
这还不离婚把他送法庭还愣着干嘛呢啊,17
大姨大概率不会离婚吧。。,12
这种男人不离婚留着干啥，未成年人都敢,18
这是要报警吧。还离不离婚，woc,16
别离婚了，报警吧,8
离婚！把财产搞到手，完了他不愿意就告诉他会去报警，未成年啊，,30
一定不要原谅！！直接离婚或分手,15
我老妈的闺蜜70岁离婚的，男的80岁出轨。。。。,24
快离婚 然后举报他,9
我天，报警然后离婚，你是受害者，你老公都这么不要脸了，还体面,30
我刚和凤凰男离婚,8
原生家庭不太好的人，会在以后找补很多缺失，懂我意思吧,26
那你不离婚留着过年啊,10
这个姐姐感觉有点不聪明啊就这还不离婚,18
六十多岁肯定不愿意离婚啊,12
所以这个姐姐但凡能找出一个过下去的理由就不离婚，咋想的呀,28
龙飞律师一真见血，这种男的真的不容易离婚,20
有路，离婚呀,6
离婚，然后学王力宏老婆,11
听起来她不想离婚,8
留证据。搞钱。离婚。保护好孩子和自己。远离老头。,24
不离婚？？等清明？？？,11
这老头看来原生家庭也是不好，赶紧离婚！,19
赶紧离婚！！！快跑！！！,12
原生家庭…………,8
离婚的时候一定要坚持，男的一家吸血她，一定会劝和，所以心一定,30
离婚啊求求你了,7
离婚！,3
把他钱都分了，跟他离婚，手里捏着把柄，这算不算绝路？,26
我觉得她听起来不想离婚,11
搞不好是老头想生个儿子,11
死老头这种人也拉不下加你离婚 对他事业不好,21
？就这都没离婚？？？？？可真行,15
这种女的 耗一阵可能还是不会离婚的……,19
这要是我妈我第一个劝她离婚,13
这位阿姨想清静也清净不起来啊，必须得有把柄才能顺利离婚吧,28
把自己的房产提前过户给孩子，不要离婚的时候被分走了,25
我有个亲戚也是高知家庭找了个很多姐姐的幺子农村家庭，离婚男的,30
我想离婚（快劝我不要离,11
奶奶！快离婚啊！,8
说不定以后还要坐牢，还要赔偿17岁少女，赶紧离婚吧！,26
原生家庭的问题，根深蒂固，太恐怖了,17
把自己的房产提前过户给孩子，不要离婚的时候被分走了,25
赶紧搞钱离婚报警一条龙,11
离婚了，老头更加放飞自我,12
孩子18岁应该离婚,9
和我爷爷好像…60多岁和我奶奶离婚 然后和一个18岁就跟着他,30
先把证据先拿到手，管他的，万一有一天他真的跟你离婚，钱都被分,30
感觉她不想离婚，UP每次让她离婚，她都不接话茬，另起一行细数,30
我觉得这阿姨是想离婚的，只是勇气还不够，她怕她赢不了那老头,29
我了去，姐姐赶紧离婚吧，再报警吧,16
姐姐离婚吧 60岁出去玩，去环游世界，做一个幸福的退休老太太,30
她在生育和事业之间选择了事业，得到了她想要的，并没有失去任何,30
你快五十岁了还想生小孩？？？？？,16
爷笑了.对她不好可以离婚.,13
这男的想生米煮熟饭,9
离婚分走一半家产呗？,10
离不离婚，还不是你说了算，你能玩死她,18
还没等到离婚，就被搞死了也是有可能的,18
离婚极有可能分走一部分身家,13
正常人离婚都难,7
然后离婚可以分走一部分财产,13
这就是他的目的，结婚然后离婚分财产,17
这就是他的目的，结婚然后离婚分财产,17
但是她智力低阿，骗一下她就会不离婚，所谓的“西方自由”学的到,30
而且，这算高龄产妇了吧，对人也不好,17
离婚了你就分财产了,9
咦现在有离婚冷静期了,10
离婚然后正大光明分财产,11
结婚然后离婚分走人家一半家产吗？,16
只要结婚就有户口，再离婚就完事了,16
离婚不好离的呀,7
高龄产妇，又可能遗传，打掉是正确的,17
结婚了监护人成你了她哪来的离婚自由,17
现在离婚越来越难,8
高龄,2
离婚分财产，美滋滋,9
离婚想分财产吧,7
监护人到时候变成男的，会让她离婚？,17
离婚要财产分割的，你可以搜刮完再走,17
跟出生地必然是有关系的呀，人口多，穷，竞争大，心眼子多这是必,30
离婚分财产啊,6
高龄产妇还是,6
17年怀孕，是43岁左右吧，真是超高龄产妇了，正常人来说都很,30
就是想生米煮成熟饭，要挟,12
这女的快五十岁了！高龄产妇啊,14
关键是孩子可能是不好，而且是高龄产妇，再加上这孩子出生肯定遭,30
如果生还是高龄产妇呀！,11
他想生个健康的就谋财产 生个有问题的就跑路,21
女人30岁以上就尽量不要生育了，高危,18
河南佬想生米煮成熟饭，好结婚骗房子，真搞笑,21
那么大的年龄高龄产妇最好不要生对身体太不好了,22
限制行为能力人就不用太考虑她的想法，因为她对于生存生育根本没,30
丁克是真好,5
妈妈离婚,4
这还不离婚,5
可以离婚了,5
确实不该玩失踪，应该直接离婚,14
一会儿准备领证，一会儿又离婚，真是条理清晰,21
追责，可能是竞争对手收买了印刷厂设计师,19
挺好的，还离婚了，没有持续祸害前夫。,18
离婚了，前夫必须暴击，要不然不好打拳,18
没离婚？更兴奋了！,9
没离婚怎么结婚哟，最下策都用不了,16
废话没离婚，谁结婚谁gg,12
是她没离婚啊，没离婚外面搞怀孕，一般人想的啥,22
看到了没，先出轨有了娃，再去离婚的,17
看到没 没男人就是活不下去 还没离婚就开始找下家,24
还照顾个屁啊。直接去三甲医院体检后，直接去法院离婚。,26
这时候提钱分手就坐实了，如果直接离婚孩子自己养，我还能高看你,30
不合理，应该要离婚，而且不应该给钱。,18
《高龄》,4
36岁确实高龄了,8
三十六确实算高龄了，四十就不建议生了,18
前面的高龄不是说他年龄大是这个年龄怀孕是高龄,22
孕期不能离婚的,7
哎，还是离婚吧，现在太累了，都不容易,18
别想再生育了,6
打胎六次，那么你还有生育功能了么？,17
这时候没提离婚真是仁至义尽,13
孕期不能离婚只能跑路了,11
够对得起他们了，直接离婚就完事了,16
不离婚是等着出殡呢？软蛋玩意,14
讲个笑话，允许生三胎,10
三胎给富人省钱，真好,10
开放三胎,4
招90后吧。这站不是很多发视频说要不婚不育的吗,23
就这还“鼓励三胎呢？,10
三孩？,3
一天一个离婚小技巧,9
离婚冷静期是近两年的，之前去了就能离婚，冷静期不背锅,26
哈哈哈哈哈哈离婚利器,10
"别说181,188也得离婚啊",14
所有人都不想你结婚，你结了。所有人不让你离婚现在你听话了,28
她就不想离婚，哪怕别人随口说一句她也要拿来当证明的。,26
我们这儿还有假装复印机坏了不让离婚的新闻呢,21
这不离婚想啥呢？ 就不该结婚,14
锁死吧，离婚可惜了,9
现在不管什么情况，第一次想离婚基本都是不给你离的,24
为什么离婚还住一起？不如孝顺自己老妈,18
不是那个想办法阻止离婚的“最美”红娘吧？？？,22
想生孩子不结婚自己生也行啊，至少不用管一大家子人，只需要养孩,30
肯定是脑补的，哪个碳基生物会用这种借口劝人不离婚,24
送孤儿院吧离婚吧，自己才是中心,15
她妈妈是不是觉得她有点傻能帮着就帮着别离婚。。,23
好好好我现在也不让你离婚，你俩一定捆一辈子，烦死了！！！,28
有这家庭条件，实在想生，当初去父留子都行啦,21
不过离婚了 祝稿主好运吧,12
婆婆明显不希望他们结婚，也不想跟她家有经济来往，怕离婚了被她,30
6，那你为啥离婚，再算一挂不就行了，算着算着 一生就过完了,29
估计是觉得原生家庭不好，就想自己成家吧,19
离婚,2
会不会算命大师是催生所的，专门提高生育率,20
让她离婚成功真是多亏了戒戒，做了件好事,19
离婚了就好，不然被这个老公吸一辈子血,18
不迷信早就离婚了，只有迷信才能说服自己将就,21
感觉就是生活环境不让人离婚的错,15
原生家庭+搞封建迷信+恋爱脑+自身性格问题,21
能离婚挺好的，但是这位大姐，别再算命了,19
如果没有经济压力，婚姻还是很幸福的,17
这就是自己想生,7
《太惨》《不想离婚》,10
“不想我离婚”是什么啊 蚌埠住了,16
啊？看你太惨不是更应该想让你离婚吗？,18
太惨还不离婚,6
这时候我家为了供大仙卖了房子 同时还买了辆新车 经济压力很大,30
那是生育保障金,7
人家确实是以结婚为目的啊，法律又没有规定结了婚就不许离婚,28
古代没有离婚吧,7
以前离婚难，给彩礼是正常的。现在离婚容易啊。,22
离婚彩礼不退，贷款你得还,12
历史个毛，历史上有这种高价彩礼的？那还说历史女的还没权利离婚,30
离婚的时候不分一半家产都算好的了。哈哈哈哈,21
可以啊！钱给谁找谁要！结婚吗，在一起一家人一起还。离婚钱在谁,30
单独立所谓的保障反而是一种歧视，你觉得对方是弱势的,25
千万不要领证，现在都可以未婚生育还领什么证啊,22
这不对啊 第二次领结婚证 不需要把离婚证上交嘛？？,25
既然国家鼓励结婚鼓励生育鼓励着鼓励那，真到损失了当然应该国家,30
怀了但是你没有权利私自打胎 这是侵犯了男方的生育权利,26
但是是女方提离婚的啊,10
男方没有生育权……,9
婚姻登记不是要出示离婚证吗？这都发现不了女方结过婚？,26
我闺蜜离婚，连男方买的五金钻戒男方的母亲都收回去了！更别说彩,30
结婚时候的债务是双方的，但是离婚了大概率会判给男的,25
没事，她不用打工离婚就行,12
不啊，她离婚了不就没了？,12
高龄产妇。。。,7
是不是就是因为这女的离婚的？,14
给了薛那么多钱，问一句怎么不离婚就成作了，男的真的，绝,27
你和人家在一起，你不离婚??,14
没离婚怎么敢公开,8
这是什么繁殖癌，有孩子就结婚没孩子就离婚，这会儿不卖对前妻的,30
出了钱不离婚，还说女方作，臭渣男,16
又不是因为女的才离婚,10
当时离婚还上了热搜主动发了离婚协议送了虹口的一套房,25
???早分居签离婚协议了差钱没付清也叫出轨?又不是瞒着高,28
出轨不就是指隐瞒对方吗？签了离婚协议这又没瞒,22
他的意思可能是如果没离婚就在外面有孩子搞出来会出事,25
薛之谦跟女方说了自己没有感情分居离婚进行中，所以李才会给他钱,30
结婚为了孩子，离婚因为流产，这种行为粉丝还能洗就觉得好笑,28
都一起买房了还没离婚。。。,13
所以为啥要离婚我都还没有看懂,14
钱拿到了就说人家催你离婚。。。,15
花了那么多钱当然着急薛快点离婚啊,16
没离婚然后和别的女的同居还怀了孩子？6,19
。。。。什么鬼 又拿人好处又不离婚 反咬人家,22
可笑的是有人还说真正的爱情是薛之谦离婚复婚的对象都是同一个人,30
录音里想离婚被高威胁 演唱会向高深情求复合 绝了,24
高克薛，一离婚薛就大火，一复合薛就塌了……,21
女方想要直接跑，生育权抓在自己手里,17
生育权在女性，也就是说生或者不生，她可以全权决定。至于男人，,30
女人想生就生，这种事情男人没有插话点资格,20
说实话，生育权为女性独有，外人干预不了,19
买断一个人的生育能力，三万够？,15
生育是对女性的压迫，所以他是好男人（狗头）,21
三万买断人家生育能力，你觉得你凭什么？,19
还没分手就想着以后自己有老婆孩子了，你女友以后不能生育就不顾,30
零和博弈嘛，大橘是利益来源，其他女人是利益竞争者,24
大橘是绝对权威，虽是夫妻并不平等，而其他人是竞争关系,26
真的就是臣妾做不到，那个时候又不能离婚，他所有的依靠都在皇上,30
如果宜修不内卷，只是安安稳稳的，皇后和太后之位很难丢,26
打了，离婚,5
那你想生下来？？,8
医院里排队流产的跟排队想生孩子的一样长,19
生育对于女性本就是不公平的。人工流产是对非意愿妊娠的补救，是,30
不想生就不要做,7
远离婚前性行为女孩子们,11
生育对于女性本就是不公平的。人工流产是对非意愿妊娠的补救，是,30
我妈当年意外怀了二胎，记得她流了一个多月的血,22
丁克竟是我自己,7
还好我不婚,5
不婚不育，洁身自好从我做起,13
难怪生育率降低,7
所以生育一定要有计划，否则就做好避孕,18
更不想生孩子了，告辞,10
女性拥有生育权,7
不想生孩子了,6
为什么不合法？她们自己有生育权,15
她们不想生就是不想生母亲也有生育权,17
已丁克，多谢,6
每一种都必须是合法的！女性有生育的自由！,20
说明我国女性能自由支配生育权 这并不是坏事,21
堕胎一定要合法，因为这样女性才有自主生育权利。,23
不想生孩子的家人们,9
这是为了教育 性教育，而且生育字由！,18
再残忍又怎样 该堕还得堕 女性有掌握自己是否生育的权利,27
不想生就别发生关系,9
不想生就不要发生关系,10
不想生就洁身自爱，别发生关系,14
但是不管怎么说生育的后遗症比堕胎大呀,18
不管自己是否选择生育，都请不要开一些过分的玩笑,23
感谢这个视频，在网络上很少能看到有关女性生育、两性知识的，虽,30
切记，纳入式是生育行为，不是性行为,17
不婚不育者表示无所畏惧,11
主动离婚，休夫，丧夫,10
每天一遍，不婚不育,9
医学界有没有性别歧视,10
生门改变了对生育的看法，生老病死，生在最前,21
丁克丁克,4
丁克,2
二胎宝妈路过,6
不想生加一，现在没什么能改变我的想法了,19
丁克丁克,4
不想生女儿了,6
那就生育时做好了,8
我妈妈身体不好，怀了第三胎才保住我和姐姐,20
想生完孩子就节扎自己...,13
其实男医生态度比女医生好的多，也不会歧视,20
男女医生是看自己个人能不能接受好吗，没有歧视男医生啊，只是不,30
男妇科医生不被接受很正常啊这不是性别歧视，谁管你gay不ga,30
之前我也看过节目 老师给我们放的 当时就觉得生育真的是一件很,30
不想生孩子,5
怪不得国家不普及性教育 女生更不想生孩子了,21
我姐8个月胎儿血管瘤不得不打针等胎死引产，今年已经生二胎了，,30
要不是互联网 还会有更多女性被蒙在上一辈子的生育谎言中,27
第一胎八周胚胎停育，第二胎现在宝宝出生6个月了,23
唉真不容易，但也想说，不婚不育真的好快乐啊,21
我妈就是 第一胎流产了 我是第二胎,17
生育是个人选择，不生不育没什么好骄傲的,19
生育本就是很艰难的事情，发生什么都不奇怪,20
并不搞笑，作为一个不想生孩子的女生我也共情到up主了，真的想,30
生育是一件很难的事情，是一个缘分，不是母亲的错,23
真的最近在了解到现代人的身体素质没以前好了 生育率低很多,28
虽然我也不婚不育，但是妈妈们真的很伟大。,20
所以说啊，只有女性能切身体会到生育的苦，生育真的是很痛苦很艰,30
看到这我只能说我更恐生育了,13
我不婚不育，把宝宝的名额给姐妹了，希望你拥有一个健康的宝宝,29
很伟大。不婚不育,8
宫缩真的，所以生啥二胎，不想再经历的噩梦,20
对我身边有那种丁克家庭 想要宝宝的事情应该是两个人共同决定的,30
生育从来不是简单的事,10
我的天呐 我不想结婚，我不想生小孩，好恐慌啊,22
我已经是二胎妈妈了，感觉你这比生孩子痛啊,20
一点都不想生孩子！,9
顺转剖，孩子生了五天，坚决不要二胎,17
就是知道得多所以我一早就放弃了生育这一选项,21
女二不可怜哈 就是她给了假离婚书陈欣怡才发生车祸,24
纪存希说的签字是离婚协议 但是安娜给陈欣怡说的还有一份流产,29
男主说的合约是离婚协议书，里面还对女主进行了补偿,24
男主以为合约只是单纯离婚，但是女二骗女主合约里面要打掉孩子,29
不是离婚协议 是人工流产同意书,15
纪存希说的是离婚的，陈欣怡以为是流产的,19
男主想给她签给她很多钱保障生活的离婚协议，女二换了假的人流同,30
纪存希让她签的有赔偿的离婚协议书，Anna给陈欣怡的是流产同,30
两个人，一个说流产同意书，一个说离婚协议书，一个讲东一个讲西,30
这里他俩都误会了，一个以为是离婚协议书，一个以为是流产手术同,30
本来是要签离婚协议书的,11
生育工具实锤,6
现在放的话肯定不会删了，因为要鼓励三胎了都,21
他给的是离婚书，但因为女配给了她流产书她以为他要把她的孩子流,30
其实法律上陈欣怡不同意离婚这男的是离不了婚的,22
换现在播的话就不用改了，因为提倡三胎了,19
好像这里存希以为是离婚协议，但里面是人工流产同意书……欣怡也,30
男主拿的是离婚协议书，女二给陈欣怡的是流产书的，陈欣怡以为男,30
存希要给的是离婚协议，安娜换成流产同意书，欣怡误会了，流产这,30
怎么不怪安娜了，她把离婚协议换成打胎的,19
本来存希已经要和她离婚了，安娜让她签字才这样,22
要不是安娜，她就不会跑出来呀，离婚协议她本来就签了,25
为什么不怪安娜？寄存希拿的是离婚协议书，但是安娜给陈欣怡看的,30
女二把男主的离婚协议换成引产手术同意书给女主了，所以女主因为,30
不怪安娜？安娜给人家流产手术同意书，纪存希给的是离婚协议书，,30
宫外孕多的很。。有的生二胎三胎最容易,18
纳入式=生育行为，不要小孩就不要纳入呗,19
我只想说太长的字置顶看不全哈，而且生育能力被妳说不公也是很好,30
了解怀孕以及相关风险再去生育，不要不做功课一头扎进去，苦的是,30
好可怕，分享自己的经历还要声明不是为了引起生育恐慌,25
不婚不育，不说芳龄永继，至少能捡两回命,19
对小孩和生育一直很抵触，甚至厌恶的程度，现在依旧如此，希望大,30
看哭了，瑞尼一定会越来越幸运的经过这次后，女性生育好伟大,28
我二胎第一个超就是阴超 伸进去的,16
女性生育的代价太大了，各种风险各种问题要面对,22
前面的，女生是可以决定自己的生育时间的。别用拖不拖，晚不晚这,30
前面有个性别歧视的弱智居然还说自己没有恶意,21
原生家庭真的很重要,9
原生家庭,4
妻子的还不和这种男的离婚，留着不嫌脏,18
这样以后还能有生育能力吗...........也太恐怖了吧,29
很简单，跟医院打官司，打赢了医院赔钱，打输了，拿着证明离婚,29
可以去医院检查，没有生育与流产的状态是不同的，可以检查出来,29
老板:你知道的我喜欢人妻，你要是离婚了我可要找新秘书了,27
看完真的想哭 去年我怀二胎 宝宝在孕六个月的时候破水了保不住,30
……流产次数多了以后想生也生不了了,17
女性不是生育机器啊,9
这男的还想生孩子 配吗,11
小产假还有生育津贴,9
我永远都跟他说我不想生孩子，要分手找别人趁早，别到时候说我耽,30
原生家庭的问题吧,8
把女性当生育工具……,10
女性不是生育工具,8
我女儿一个我就够了。二胎。我yeu,17
这个女孩子的原生家庭教育估计也不太好,18
原生家庭没给她多少爱吧,11
原生家庭带来的自卑吧 可能出身不好 但一个愿打 一个愿挨,28
到时候结婚又被男友嫌弃不能生育,15
这个女生好卑微啊！可能是来自原生家庭的伤害吧,22
我觉得可能跟原生家庭有关 唉,14
这姑娘的原生家庭肯定有问题,13
还没结婚就想着离婚,9
但是以后想生孩子的时候怀不上，那那个狗男人又会说不是他的问题,30
等到哪一天这个男的想要小孩了，这个女的还有生育能力吗。。怕不,30
这？原生家庭绝对有问题！,12
我生了二胎想让我老公结扎，但是我爸妈说结扎了我老公就成太监了,30
她男友应该是不会跟她结婚的，男的不会拿自己老婆的生育能力这么,30
这男的最后因为她不能生育或者身体不好了，这男的肯定不要她了,29
如果原生家庭的养育够好，给的爱够多，她也不会这样,24
在我国，生育知识完全不教，人流广告却满天飞,21
有一次跟医生门诊时遇到一个高龄患者，说要怀孕行不行，医生问为,30
大家别劝了，这是自然选择，她就应该流到失去生育能力,25
原生家庭,4
我敢保证，这男的最后会嫌弃她说她不能生育跟她分手,24
内卷人,3
本来就门不当户不对，现代也是，不歧视但融入难,22
离婚干啥，阿昌多好,9
这是以前离婚率低的原因，根本没有离婚权利,20
不是歧视平民的问题，她的职业是陪酒女所以不敢说,23
因为祝家对她一直有歧视加上老公意外离世，在她的视角里大家害她,30
要我我就离婚，渣男渣女死远一点,15
这网友根本不是来问要不要离婚的，而是咨询捞钱手段的,25
婆媳关系那么差，平时没少挑拨吧,15
离婚了那不就又要祸害老实人了..,16
你别说气话噻，直接离婚协议书给她噻,17
在一起不幸福，可以离婚的，对彼此都好,18
离婚啊,3
仙女对常年家暴（冷暴力）忍无可忍，愤然提出离婚，真是“新时代,30
坟头蹦迪谁不离婚⚮⚮⚮⚮,12
加油离婚,4
别离婚，继续在一起吧,10
想提前离婚？怕检查出孩子不是他的，怕净身出户,22
卧龙凤雏，别离婚害人,10
怀孕不准离婚的,7
你们两千万不要离婚不要再害人,14
你俩可千万不能离婚啊，一定要在一起，千万不能祸害别人啊，乖听,30
绝配，不准离婚害别人,10
绝配，这对可不能离婚啊,11
离婚吧,3
千万别离婚，你们俩真的挺合适的,15
求求别离婚,5
怀疑期间能离婚吗？,9
千万不要离婚不然要求祸害别人了,15
这一对千万别离婚！！,10
女的和妈妈姓，应该也是离婚了或者爸爸死了,20
流掉离婚不好么，这俩人都不适合生育孩子,19
真是别离婚了，免得坑害别人,13
还是不要离婚去祸害其他人了,13
两个都不是好东西，别离婚免得让其他人受害,20
别离婚去害老实人了吧,10
别离婚，可别去祸祸好人,11
这两个无论结几次婚最后都是离婚收场,17
孩子才七个月，肯定不能离婚,13
艾玛，可别离婚了,8
以后结婚还是先考试吧，然后规定多少年才能离婚，或者婚内出轨，,30
支持男方离婚,6
你两凑合过吧，别离婚,10
现在孩子出来，父亲不知道是谁的又闹离婚,19
就是想离婚骗钱,7
别离婚了 一起过吧，反正都是渣男渣女,18
为什么不报道我 我为了找到工作都不婚不育了,21
打工人请假＝失业,8
丁克吧，小朋友真可怜,10
难道师母不该骂么 师母也是瞎 直接离婚才是正确解决方式,27
前面的我觉得比起管她老公最好还是离婚，出轨只有零次和无数次（,30
这还能二胎 尊重祝福吧,11
小三确实可恶，那么是不是男老师离婚了，你就不想告他了？,27
老师夫妻还要二胎，神来之笔,13
搞臭他 让他失业也行啊,11
还二胎,3
说啥咋不和男友分手 咋不让男的离婚呢doge,22
你要真想和他在一起先离婚先分手啊，老师禽兽女孩也没说的那么无,30
很好奇女孩的原生家庭,10
还二胎?嫌孩子受的苦少吗?,13
还二胎,3
这男人最不是东西，那老婆还生了二胎，女孩大学了应该有了自己的,30
我大学的老师就夸张了，直接离婚让这个学生女孩当时21岁怀孕嫁,30
人家有老婆，有孩子，是不会离婚的,16
天呀，看完这个都不想生孩子了！太可怕了,19
有本事离婚 在是真爱,10
笑死 二胎都要有了,9
建议直接离婚 这种婆婆和男人不要也罢，简直活阎罗,24
趁机想离婚吧这是,8
先离婚再起诉医院,8
